questionId,questions,lang
20,آی.بی.آم. چند کارمند دارد؟,fa
20,Wieviele Angestellte hat IBM?,de
20,¿Cuántos empleados tiene IBM?,es
20,Quanti dipendenti ha IBM?,it
20,Combien d'employés a IBM?,fr
20,Hoeveel medewerkers heeft IBM?,nl
20,Câți angajați are IBM?,ro
21,Which states border Illinois?,en
21,ایلینوی با چه ایالت هایی هم مرز است؟,fa
21,Welche Staaten grenzen an Illinois?,de
21,¿Qué estados tienen frontera con Illinois?,es
21,Con quali stati confina l'Illinois?,it
21,Quels sont les états voisins de l'Illinois?,fr
21,Welke staten grenzen aan Illinois?,nl
21,Ce state formează granite cu Illinois?,ro
22,In which country is the Limerick Lake?,en
22,دریاچه لیمریک در کدام کشور است؟,fa
22,In welchem Land befindet sich der Limerick Lake?,de
22,¿En qué país se encuentra el lago Limerick?,es
22,In quale stato si trova il lago Limerick?,it
22,Dans quel pays se trouve le lac Limerick?,fr
22,In welk land ligt Limerick Lake?,nl
22,În ce țară este lacul Limerick?,ro
23,Which television shows were created by John Cleese?,en
23,چه نمایش های تلویزیونی توسط جان کلیز ساخته شدند؟,fa
23,Welche Fernsehserien hat John Cleese entworfen?,de
23,¿Qué series televisivas ideó John Cleese?,es
23,Quali serie televisive sono state create dalla John Cleese?,it
23,Quelles séries télevisées ont été créées par John Cleese?,fr
23,Welke televisieseries werden bedacht door John Cleese?,nl
23,Ce seriale de televiziune au fost create de John Cleese?,ro
24,Which mountain is the highest after the Annapurna?,en
24,بلندترین کوه پس از آناپورنا چیست؟,fa
24,Was ist der höchste Berg nach dem Annapurna?,de
24,¿Cuál es la montaña más alta después del Annapurna?,es
24,Qual è la montagna più alta dopo l'Annapurna?,it
24,Quelle est la montagne la plus haute après l'Annapurna?,fr
24,Welke berg is na de Annapurna de hoogste berg?,nl
24,Care este cel mai înalt munte după Annapurna?,ro
25,In which films directed by Garry Marshall was Julia Roberts starring?,en
25,در چه فیلمی که توسط گری مارشال کارگردانی شد جولیا رابرتس بازی کرد؟,fa
25,"In welchem Filmen, bei denen Garry Marshall Regie geführt hat, hat Julia Roberts mitgespielt?",de
25,¿En qué películas dirigidas por Garry Mashall actuó Julia Roberts?,es
25,In quali film diretti da Garry Marshall recita Julia Roberts?,it
25,Dans quels films dirigés par Garry Marshall joue Julia Roberts?,fr
25,In welke films die werden geregisseerd door Garry Marshall speelde Julia Roberts?,nl
25,În ce filme regizate de Garry Marsall a jucat Julia Roberts roluri principale?,ro
26,Which bridges are of the same type as the Manhattan Bridge?,en
26,چه پل هایی هم نوع پل منهتن هستند؟,fa
26,Welche Brücken sind vom gleichen Typ wie die Manhattan Bridge?,de
26,¿Qué puentes son del mismo tipo que el puente de Manhattan?,es
26,Quali ponti sono dello stesso tipo del ponte di Manhattan?,it
26,Quels ponts sont du même type que le pont de Manhattan?,fr
26,Welke bruggen zijn van hetzelfde type als de Manhattan Bridge?,nl
26,Ce poduri sunt de același tip ca cel din Manhattan?,ro
27,Was U.S. president Jackson involved in a war?,en
27,آیا رئیس جمهور ایالات متحده جکسون درگیر جنگی شد؟,fa
27,War US-Präsident Jackson in einen Krieg verwickelt?,de
27,¿Estuvo el el presidente de los estados unidos Jackson involucrado en una guerra?,es
27,Il presidente degli Stati Uniti Jackson è stato coinvolto in una guerra?,it
27,Le président Jackson a-t-il participé à une guerre?,fr
27,Was president Jackson van de Verenigde Staten betrokken bij een oorlog?,nl
27,A fost președintele american Jackson implicat într-un război?,ro
28,Give me all communist countries.,en
28,تمام کشورهای کمونیست را لیست کن.,fa
28,Gib mir alle kommunistischen Länder.,de
28,Dame todos los países comunistas.,es
28,Dammi tutti i paesi comunisti.,it
28,Donnes-moi tous les pays communistes.,fr
28,Geef alle communistische landen.,nl
28,Dă-mi toate țările comuniste.,ro
29,Which awards did Douglas Hofstadter win?,en
29,داگلاس هافستادر چه جایزه هایی را برد؟,fa
29,Welche Preise hat Douglas Hofstadter gewonnen?,de
29,¿Qué premios ha ganado Douglas Hofstadter?,es
29,Quali premi ha vinto Douglas Hofstadter?,it
29,Quels prix ont été gagnés par Douglas Hofstadter?,fr
29,Welke prijzen heeft Douglas Hofstadter gewonnen?,nl
29,Ce premii a câștigat Douglas Hofstadter?,ro
3,Who is the daughter of Robert Kennedy married to?,en
3,دختر رابرت کندی با چه کسی ازدواج کرده است؟,fa
3,Mit wem ist die Tochter von Robert Kennedy verheiratet?,de
3,¿Con quién está casada la hija de Robert Kennedy?,es
3,Con chi è sposata la figlia di Robert Kennedy?,it
3,Qui est l'époux de la fille de Robert Kennedy?,fr
3,Met wie is de dochter van Robert Kennedy getrouwd?,nl
3,Cu cine este căsătorită fiica lui Robert Kennedy?,ro
30,Which U.S. state has the highest population density?,en
30,کدام ایالت ایالات متحده بیشترین تراکم جمعیت را دارد؟,fa
30,Welcher Staat in den USA hat die höchste Bevölkerungsdichte?,de
30,¿Que estado de los estados unidos de america tiene la mayor densidad de población?,es
30,Quale stato americano ha la densità di popolazione maggiore?,it
30,Quel état des Etats-Unis a la plus haute densité de population?,fr
30,Welke deelstaat van de Verenigde Staten heeft de hoogste bevolkingsdichtheid?,nl
30,Ce stat American are cea mai mare densitate a populației?,ro
31,What is the currency of the Czech Republic?,en
31,واحد پول جمهوری چک چیست؟,fa
31,Was ist die Währung der Tschechischen Republik?,de
31,¿Cuál es la moneda de la república checa?,es
31,Qual è la valuta della Repubblica Ceca?,it
31,Quel est la devise de la Tchéquie?,fr
31,Wat is de munteenheid van Tsjechië?,nl
31,Care este moneda națională a Cehiei?,ro
32,Which countries adopted the Euro?,en
32,کدام کشورها یورو را قبول کردند؟,fa
32,Welche Länder haben den Euro übernommen?,de
32,¿Qué países han introducido el Euro?,es
32,Quali stati hanno introdotto l'Euro?,it
32,Quels pays ont adopté l'Euro?,fr
32,Welke landen hebben de Euro geïntroduceerd?,nl
32,În ce țări a fost introdus euro?,ro
33,What is the area code of Berlin?,en
33,پیش شماره برلین چند است؟,fa
33,Was ist die Vorwahl von Berlin?,de
33,¿Cuál es el prefijo de Berlin?,es
33,Qual è il prefisso di Berlino?,it
33,Quel est l'indicatif téléphonique de Berlin?,fr
33,Wat is het kengetal van Berlijn?,nl
33,Care este prefixul telephonic pentru Berlin?,ro
34,Which countries have more than two official languages?,en
34,چه کشورهایی بیش از دو زبان رسمی دارند؟,fa
34,Welche Länder haben mehr als zwei Amtssprachen?,de
34,¿Qué países tienes más de dos lenguas oficiales?,es
34,Quali stati hanno più di due lingue ufficiali?,it
34,Quels pays ont plus de deux langues officielles?,fr
34,Welke landen hebben meer dan twee officiële talen?,nl
34,Ce țări au mai mult de două limbi oficiale?,ro
35,Who is the owner of Rolls-Royce?,en
35,چه کسی مالک رولز-رویس است؟,fa
35,Wem gehört Rolls-Royce?,de
35,¿Quién es el dueño de Rolls-Royce?,es
35,Chi è il proprietario di Rolls-Royce?,it
35,À qui appartient Rolls-Royce?,fr
35,Wie is de eigenaar van Rolls-Royce?,nl
35,Cine este proprietarul Rolls-Royce?,ro
36,Through which countries does the Yenisei river flow?,en
36,رود ینی سئی از چه کشورهایی می گذرد؟,fa
36,Durch welche Länder fließt der Yenisei?,de
36,¿Por qué países fluye el río Yenisei?,es
36,Attraverso quali stati scorre il fiume Yenisei?,it
36,Quels sont les pays traversés par l'Ienisseï?,fr
36,Door welke landen stroomt de Jenisej?,nl
36,Ce țări traversează fluviul Enisei?,ro
37,When did Latvia join the EU?,en
37,لتونی کی به اتحادیه اروپا پیوست؟,fa
37,Wann ist Lettland der EU beigetreten?,de
37,¿Cuándo ingresó Letonia a la unión europea?,es
37,Quando la Lettonia è entrata nell'Unione Europea?,it
37,Quand est la Lettonie devenue membre de l'Union européene?,fr
37,Wanneer trad Letland toe tot de EU?,nl
37,Când a aderat Letonia la Uniunea Europeană?,ro
38,Which politicians were married to a German?,en
38,چه سیاستمدارانی با یک آلمانی ازدواج کردند؟,fa
38,Welche Politiker waren mit jemand deutschem verheiratet?,de
38,¿Qué monárcas estaban casados con una persona alemana?,es
38,Quali politici erano sposati con persone tedesche?,it
38,Quels monarques ont épousé une personne allemande?,fr
38,Welke politici waren getrouwd met een Duitser?,nl
38,Ce politicieni au fost căsătoriți cu o persoană germană?,ro
39,When was the Battle of Gettysburg?,en
39,نبرد گتیسبورگ کی رخ داد؟,fa
39,Wann fand die Schlacht von Gettysburg statt?,de
39,¿Cuándo tuvo lugar la batalla de Gettysburg?,es
39,Quando ha avuto luogo la battaglia di Gettysburg?,it
39,Quand se déroula la bataille de Gettysburg?,fr
39,Wanneer was de Slag bij Gettysburg?,nl
39,Când a fost bătălia de la Gettysburg?,ro
4,Which river does the Brooklyn Bridge cross?,en
4,پل بروکلین از روی چه رودی می گذرد؟,fa
4,Welchen Fluss überspannt die Brooklyn Bridge?,de
4,¿Por qué río cruza la Brooklyn Bridge?,es
4,Quale fiume attraversa il ponte di Brooklyn?,it
4,Quelle cours d'eau est traversé par le pont de Brooklyn?,fr
4,Welke rivier overspant de Brooklyn Bridge?,nl
4,Ce râu traversează podul din Brooklyn?,ro
40,What is the highest mountain in Australia?,en
40,مرتفع ترین کوه در استرالیا چیست؟,fa
40,Was ist der höchste Berg in Australien?,de
40,¿Cuál es la montaña más alta de Australia?,es
40,Qual è la montagna più alta d'Australia?,it
40,Quelle est la plus haute montagne d'Australie?,fr
40,Wat is de hoogste berg van Australië?,nl
40,Care este cel mai înalt munte din Australia?,ro
41,Give me all soccer clubs in Spain.,en
41,تمام باشگاه های فوتبال در اسپانیا را لیست کن.,fa
41,Gib mir alle Fußballvereine in Spanien.,de
41,Dame todos los club de fútbol de España.,es
41,Dammi tutti i club calcistici della Spagna,it
41,Donnes-moi tous les clubs de football d'Espagne.,fr
41,Noem alle Spaanse voetbalclubs.,nl
41,Dă-mi toate cluburile de fotbal din Spania,ro
42,What is the official language of Suriname?,en
42,زبان رسمی سورینام چیست؟,fa
42,Was ist die Amtssprache Von Surinam?,de
42,¿Cuál es la idioma oficial de Surinam?,es
42,Qual è la lingua ufficiale del Suriname?,it
42,Quelle est la langue officielle du Suriname?,fr
42,Wat is de officiële taal van Suriname?,nl
42,Care este limba oficială din Suriname?,ro
43,Who is the mayor of Tel Aviv?,en
43,چه کسی شهردار تل آویو است؟,fa
43,Wer ist der Bürgermeister von Tel Aviv?,de
43,¿Quién es el alcalde de Tel Aviv?,es
43,Chi è il sindaco di Tel Aviv?,it
43,Qui est le maire de Tel Aviv?,fr
43,Wie is de burgemeester van Tel Aviv?,nl
43,Cien este primarul din Tel Aviv?,ro
44,Who designed the Brooklyn Bridge?,en
44,چه کسی پل بروکلین را طراحی کرد؟,fa
44,Wer hat die Brooklyn Bridge entworfen?,de
44,¿Quién diseñó la Brooklyn Bridge?,es
44,Chi ha progettato il ponte di Brooklyn?,it
44,Qui a conçu le pont de Brooklyn?,fr
44,Wie ontwierp de Brooklyn Bridge?,nl
44,Cine a proiectat podul din Brooklyn?,ro
45,Which telecommunications organizations are located in Belgium?,en
45,چه سازمان های مخابراتی در بلژیک واقع شده اند؟,fa
45,Welche Telekommunikationsunternehmen haben ihren Sitz in Belgien?,de
45,¿Qué empresas de telecomunicaciones tienen su sede en Bélgica?,es
45,Quali aziende di telecomunicazione hanno sede in Belgio?,it
45,Quelles agences de télécommunication sont situées en Belgique?,fr
45,Welke telecom-bedrijven zijn gevestigd in België?,nl
45,Ce agenții de telecomunicații sunt localizate în Belgia?,ro
46,Is Frank Herbert still alive?,en
46,آیا فرانک هربرت هنوز زنده است؟,fa
46,Lebt Frank Herbert noch?,de
46,¿Todavía vive Frank Herbert?,es
46,Frank Herbert è ancora vivo?,it
46,Frank Herbert est-il encore en vie?,fr
46,Leeft Frank Herbert nog?,nl
46,Este Frank Herbert încă în viață?,ro
47,What is the highest place of the Urals?,en
47,بالاترین نقطه در اورال کجاست؟,fa
47,Was ist die höhchste Stelle des Ural?,de
47,¿Cuál es el punto más alto del montes Urales?,es
47,Qual è il punto più alto del Uràli?,it
47,Quel est l'endroit le plus haut d'Oural?,fr
47,Wat is het hoogste punt van de Oeral?,nl
47,Care este cel mai înalt punct de pe munții Urali?,ro
48,Who is the editor of Forbes?,en
48,ویراستار فوربز کیست؟,fa
48,Wer ist der Herausgeber von Forbes?,de
48,¿Quién es el editor de Forbes?,es
48,Chi è l'editore di Forbes?,it
48,Qui est le rédacteur en chef de Forbes?,fr
48,Wie is de uitgever van Forbes.,nl
48,Cine este editorul Forbes?,ro
49,Give me all companies in the advertising industry.,en
49,تمام شرکت هایی که در صنعت تبلیغات فعال هستند را لیست کن.,fa
49,"Gib mir alle Unternehmen, die in der Werbebranche tätig sind.",de
49,Dame todas las empresas publicitarias.,es
49,Dammi tutte le aziende pubblicitarie.,it
49,Donnes-moi toutes les agences de publicité.,fr
49,Noem alle bedrijven die in de reclamebranche actief zijn.,nl
49,Dă-mi toate companiile din industria publicitară.,ro
5,How many countries are there in Europe?,en
5,چه تعداد کشور در اروپا هستند؟,fa
5,Wieviele Länder gibt es in Europa?,de
5,¿Cuántos países existen en Europa?,es
5,Quanti stati ci sono in Europa?,it
5,Combien de pays sont-il en Europe?,fr
5,Hoeveel landen zijn er in Europa?,nl
5,Câte țări sunt în Europa?,ro
50,What did Bruce Carver die from?,en
50,بروس کارور در اثر چه چیزی فوت کرد؟,fa
50,Woran ist Bruce Carver gestorben?,de
50,¿De qué murió Bruce Carver?,es
50,Di cosa è morto Bruce Carver?,it
50,Quel est la cause de décès de Bruce Carver?,fr
50,Waaraan overleed Bruce Carver?,nl
50,Din ce cauză a murit Bruce Carver?,ro
51,Give me all libraries established earlier than 1400.,en
51,تمام کتاب خانه هایی که قبل از 1400 تأسیس شدند را لیست کن.,fa
51,"Gib mir alle Bibliotheken, die vor 1400 gegründet worden.",de
51,Dame todas las bibliotecas que fueron establecidas antes de 1400.,es
51,Dammi tutte le biblioteche fondate prima del 1400.,it
51,Donnes-moi toutes les bibliothèques établies avant 1400.,fr
51,Geef me alle bibliotheken die voor 1400 werden opgericht.,nl
51,Dă-mi tote bibliotecile înființate înainte de 1400,ro
52,Which presidents were born in 1945?,en
52,چه رئیس جمهورهایی در 1945 متولد شدند؟,fa
52,Welche Präsidenten wurden 1945 geboren?,de
52,¿Qué presidentes nacieron en 1945?,es
52,Quali presidenti sono nati nel 1945?,it
52,Quels présidents sont nés en 1945?,fr
52,Welke presidenten werden geboren in 1945?,nl
52,Ce președinți au fost născuți în 1945,ro
53,Give me all federal chancellors of Germany.,en
53,تمام صدراعظم های آلمان را لیست کن.,fa
53,Gib mir alle Bundeskanzler.,de
53,Dame todos los cancilleres alemanos.,es
53,Dammi tutti i cancellieri tedeschi.,it
53,Donnes-moi tous les chancelièrs allemands.,fr
53,Noem alle Duitse bondskanseliers.,nl
53,Dă-mi toți cancelarii federali ai Germaniei,ro
54,Who was the wife of U.S. president Lincoln?,en
54,چه کسی همسر رئیس جمهور ایالات متحده لینکلن بود؟,fa
54,Wer war die Frau von US-Präsident Lincoln?,de
54,¿Quién fué la mujer del presidente americano Lincoln?,es
54,Chi era la moglie del presidente degli Stati Uniti Lincoln?,it
54,Qui était l'épouse du président américain Lincoln?,fr
54,Wie was de vrouw van de Amerikaanse president Lincoln?,nl
54,Cine a fost soția președintelui American Lincoln?,ro
55,Who developed the video game World of Warcraft?,en
55,چه کسی بازی ویدئویی ورلد آف وارکرافت را ساخت؟,fa
55,Wer hat das Videospiel World of Warcraft entwickelt?,de
55,¿Quién desarrolló el videojuego Warcraft?,es
55,Chi ha creato il videogioco World of Warcraft?,it
55,Qui a développé World of Warcraft?,fr
55,Wie heeft het videospel World of Warcraft ontwikkeld?,nl
55,Cine a dezvoltat jocul video World of Warcraft?,ro
56,What is the official website of Tom Cruise?,en
56,وبسایت رسمی تام کروز چیست؟,fa
56,Was ist die offizielle Website von Tom Cruise?,de
56,¿Cuál el la página de Web oficial de Tom Cruise?,es
56,Qual è il sito internet ufficiale di Tom Cruise?,it
56,Quel est le site web officiel de Tom Cruise?,fr
56,Wat is de officiële website van Tom Cruise?,nl
56,Care este website-ul oficial al lui Tom Cruise?,ro
57,List all episodes of the first season of the HBO television series The Sopranos.,en
57,تمام قسمت های فصل اول سریال تلویزیونی سوپرانوز متعلق به اچ.بی.او را لیست کن.,fa
57,Liste alle Episoden der ersten Staffel der HBO-Fernsehserie Die Sopranos auf.,de
57,Dame todos los episodios de la prímera época de la serie de HBO Los Sporanos.,es
57,Elenca tutti gli episodi della prima stagione della serie televisiva di HBO i Sopranos.,it
57,Donnes-moi tous les épisodes de la première saison de la série télévisée de HBO les Sopranos.,fr
57,Noem alle afleveringen van het eerste seizoen van de HBO-serie The Sopranos.,nl
57,Listează toate episodele din primul sezon al serialului HBO de televiziune The Sopranos,ro
58,Who produced the most films?,en
58,چه کسی بیشترین تعداد فیلم را تولید کرده است؟,fa
58,Wer hat die meisten Filme produziert?,de
58,¿Quién ha producido más películas?,es
58,Chi ha prodotto più film?,it
58,Qui a produit le plus de films?,fr
58,Wie produceerde de meeste films?,nl
58,Cine a produs cele mai multe filme?,ro
59,Give me all people with first name Jimmy.,en
59,تمام افرادی که اسم کوچک آنها جیمی است را لیست کن.,fa
59,"Gib mir alle Personen, die den Vornamen Jimmy haben.",de
59,Dame todas las personas con el nombre propio Jimmy.,es
59,Dammi tutte le persone il cui nome è Jimmy.,it
59,Donnes-moi toutes les personnes dont le prénom est Jimmy.,fr
59,Noem alle personen met de voornaam Jimmy.,nl
59,Dă-mi toate persoanele cu prenumele Jimmy,ro
6,In which city did John F. Kennedy die?,en
6,جان اف. کندی در کدام شهر فوت کرد؟,fa
6,In welcher Stadt ist John F. Kennedy gestorben?,de
6,¿En qué ciudad murió John F. Kennedy?,es
6,In quale città morì John F. Kennedy?,it
6,Dans quelle ville est mort John F. Kennedy?,fr
6,In welke stad kwam John F. Kennedy om het leven?,nl
6,În ce oraș a murit John F. Kennedy?,ro
60,Is there a video game called Battle Chess?,en
60,آیا بازی ویدئویی به نام بتل چس وجود دارد؟,fa
60,"Gibt es ein Videospiel, das Battle Chess heißt?",de
60,¿Hay algún videojuego que se llame Battle Chess?,es
60,Esiste un videogioco che si chiama Battle Chess?,it
60,Existe-t-il un jeu vidéo appelé Battle Chess?,fr
60,Bestaat er een videospel met de naam Battle Chess?,nl
60,Există un joc video numit Battle Chess?,ro
61,Which mountains are higher than the Nanga Parbat?,en
61,چه کوه هایی از نانگا پاربات بلندتر هستند؟,fa
61,Welche Berge sind höher als der Nanga Parbat?,de
61,¿Qué montañas son más altas que el Nanga Parbat?,es
61,Quali montagne sono più alte del Nanga Parbat?,it
61,Quelles montagnes sont plus hautes que le Nanga Parbat?,fr
61,Welke bergen zijn hoger dan de Nanga Parbat?,nl
61,Ce munți sunt mai mari decât Nanga Parbat?,ro
62,Who created Wikipedia?,en
62,چه کسی ویکی پدیا را ساخت؟,fa
62,Wer hat Wikipedia gegründet?,de
62,¿Quién creó Wikipedia?,es
62,Chi ha creato Wikipedia?,it
62,Qui est le créateur de Wikipedia?,fr
62,Wie heeft Wikipedia opgericht?,nl
62,Cine a creat Wikipedia?,ro
63,Give me all actors starring in Last Action Hero.,en
63,تمام بازیگرانی که در لست اکشن هیرو بازی کردند را لیست کن.,fa
63,"Gib mir alle Schauspieler, die in Last Action Hero mitgespielt haben.",de
63,Dame todos los actores que hayan actuado en Last Action Hero.,es
63,Dammi tutti gli attori che hanno recitato in Last Action Hero.,it
63,Noem alle acteurs uit de film Last Action Hero.,fr
63,Noem alle acteurs uit de film Last Action Hero.,nl
63,Dă-mi toți actorii cu roluri principale în Last Action Hero.,ro
64,Which software has been developed by organizations founded in California?,en
64,چه نرم افزارهایی توسط سازمان هایی که در کالیفرنیا تأسیس شدند توسعه یافته است؟,fa
64,"Welche Softwareprodukte wurde von Unternehmen entwickelt, die in Kalifornien gegründet wurden?",de
64,¿Qué productos de software han sido desarrollados por empresas fundadas en California?,es
64,Quali software sono stati sviluppati da aziende fondate in California?,it
64,Quels logiciels ont été dévelopés par des agences fondées en Californie?,fr
64,Welke software is ontwikkeld door bedrijven opgericht in Californië?,nl
64,Ce software a fost dezvoltat de organizații fondate în California,ro
65,Which companies work in the aerospace industry as well as in medicine?,en
65,چه شرکت هایی در صنعت هوافضا و نیز پزشکی فعال هستند؟,fa
65,Welche Unternehmen sind sowohl in der Luft- und Raumfahrt als auch im Bereich der Medizin tätig?,de
65,¿Qué empresas aerospaciales trabajar también en en medicina?,es
65,Quali aziende si occupano sia nell'industria aerospaziale che in ambito medico?,it
65,Quelles companies travaillent dans l'aérospatial et dans la médecine?,fr
65,Welke bedrijven zijn zowel actief in de ruimtevaartindustrie als in de geneeskunde?,nl
65,"Ce companii lucrează în industria aerospațială, precum și în medicină?",ro
66,Is Christian Bale starring in Velvet Goldmine?,en
66,آیا کریستین بیل در ولوت گولدماین بازی می کند؟,fa
66,Spielt Christian Bale in Velvet Goldmine mit?,de
66,¿Actúa Christian Bale en Velvet Goldmine?,es
66,Christian Bale ha recitato in Velvet Goldmine?,it
66,Christian Bale joue-t-il dans Velvet Goldmine?,fr
66,Speelt Christian Bale in Velvet Goldmine?,nl
66,Joacă Christian Bale un rol principal în Velvet Goldmine?,ro
67,Give me the websites of companies with more than 500000 employees.,en
67,وبسایت شرکت های با بیش از 500000 کارمند را لیست کن.,fa
67,Gib mir alle Webseiten von Unternehmen mit mehr als 500000 Angestellten.,de
67,Dame todas las páginas de Web de empresas con más de 500000 empleados.,es
67,Dammi tutti i siti internet di aziende con più di 500000 dipendenti.,it
67,Donnes-moi les sites webs de companies avec plus de 500000 employés.,fr
67,Geef me de websites van alle ondernemingen met meer dan 500000 werknemers.,nl
67,Dă-mi toate website-urile de la companiile cu mai mult de 500000 de angajați,ro
68,Which actors were born in Germany?,en
68,چه بازیگرانی در آلمان متولد شدند؟,fa
68,Welche Schauspieler wurden in Deutschland geboren?,de
68,¿Qué actores nacieron en Alemania?,es
68,Quali attori sono nati in Germania?,it
68,Quels acteurs sont nés en Allemagne?,fr
68,Welke acteurs zijn geboren in Duitsland?,nl
68,Ce actori au fost născuți în Germania?,ro
69,Which caves have more than 3 entrances?,en
69,چه غارهایی بیشتر از 3 ورودی دارند؟,fa
69,Welche Höhlen haben mehr als 3 Eingänge?,de
69,¿Qué cuevas tienen más de 3 entradas?,es
69,Quali grotte hanno più di 3 entrate?,it
69,Quelles grottes ont plus de 3 entrées?,fr
69,Welke grotten hebben meer dan drie ingangen?,nl
69,Ce peșteri au mai mult de 3 intrări?,ro
7,Was the wife of president Lincoln called Mary?,en
7,آیا همسر رئیس جمهور لینکلن مری نام داشت؟,fa
7,Hieß die Frau von Präsident Lincoln Mary?,de
7,¿La mujer del presidente Lincoln se llama Mary?,es
7,La moglie del presidente Lincoln si chiamava Mary?,it
7,Est-ce que l'épouse du président Lincoln s'appelait Mary?,fr
7,Heette de echtgenote van president Lincoln Mary?,nl
7,Este soția președintelui Lincoln numită Mary?,ro
70,Give me all films produced by Hal Roach.,en
70,تمام فیلم های تولید شده توسط هال روچ را لیست کن.,fa
70,Gib mir alle Filme des Produzenten Hal Roach.,de
70,Dame todas las películas del producente Hal Roach.,es
70,Dammi tutti i film prodotti da Hal Roach.,it
70,Donnes-moi tous les films produits par Hal Roach.,fr
70,Noem alle films die zijn geproduceerd door Hal Roach.,nl
70,Dă-mi toate filmele produse de Hal Roach,ro
71,Give me all video games published by Mean Hamster Software.,en
71,تمام بازی های ویدئویی که توسط مین همستر سافتور منتشر شدند را لیست کن.,fa
71,Gib mir alle Videospiele von Mean Hamster Software.,de
71,Dame todos los videojuegos de Mean Hamster Software.,es
71,Dammi tutti i videogiochi di Mean Hamster Software.,it
71,Donnes-moi tous les jeux vidéos publiés par Mean Hamster Software.,fr
71,Geef me alle videogames van Mean Hamster Software.,nl
71,Dă-mi toate jocurile video publicate de Mean Hamster Software,ro
72,Which languages are spoken in Estonia?,en
72,چه زبان هایی در استونی صحبت می شود؟,fa
72,Welche Sprachen werden in Estland gesprochen?,de
72,¿Qué idiomas se hablan en Estonia?,es
