input_lang,output_lang
Which writers studied in Istanbul?,چه نویسندگانی در استانبول تحصیل کردند؟
What other books have been written by the author of The Fault in Our Stars?,چه کتاب های دیگری توسط نویسنده گسل در ستاره های ما نوشته شده اند؟
For which label did Elvis record his first album?,  آلبوم  اولین  خود  رکورد  الویس  انجام داد  برچسب  که  برای
Is Christian Bale starring in Batman Begins?,  شروع می شود؟  بتمن  که در  بازیگران  بیل  مسیحی  است
Which holidays are celebrated around the world?,چه تعطیلاتی در جهان جشن گرفته میشود؟
What is the smallest city by area in Germany?,کم مساحتترین شهر آلمان کدام است؟
List all episodes of the first season of the HBO television series The Sopranos!,همه قسمت های فصل اول سریال سوپرانو شبکه HBO را لیست کن.
Does the new Battlestar Galactica series have more episodes than the old one?,  یکی؟  قدیمی  این  از  قسمت ها  بیشتر  دارند  سلسله  گالاکتیکا  Battlestar  جدید  این  میکند
Who played Agent Smith in Matrix?,چه کسی مامور اسمیت را در ماتریکس بازی کرد؟
In which U.S. state is Fort Knox located?,  واقع شده؟  ناکس  فورت  است  حالت  ایالات متحده  که  که در
Give me all cities in New Jersey with more than 100000 inhabitants.,  لیست تمام شهرهای نیو جرسی که جمعیت آنها بیش از ۱۰۰هزار نفر است.
Give me all B-sides of the Ramones.,تمام پشت صفحه های رامونز را لیست کن.
What is the largest city in america?,  آمریكا  که در  شهر  بزرگترین  این  است  چی
Is Cola a beverage?,آیا کولا یک نوشیدنی است؟ 
What is the alma mater of the chancellor of Germany Angela Merkel?,  مرکل؟  آنجلا  آلمان  از  صدراعظم  این  از  مادر  alma  این  است  چی
Who wrote the book Les Piliers de la terre?,چه کسی کتاب قطب های زمین را نوشته است؟
Where is the birthplace of Goethe?,  گوته  از  زادگاه  این  است  جایی که
Was the Cuban Missile Crisis earlier than the Bay of Pigs Invasion?,آیا بحران موشک های کوبایی قبل از عملیات خلیج خوک ها بوده؟
Who created Wikipedia?,چه کسی ویکیپدیا را ساخته است؟
What is the highest mountain in Saxony Germany?,بلندترین کوه در ساکسونی آلمان کجاست؟
Who is the current federal minister of finance in Germany?,  آلمان؟  که در  دارایی، مالیه، سرمایه گذاری  از  وزیر  فدرال  جاری  این  است  که
In which country is Mecca located?,مکه در کدام کشور قرار گرفته است؟
In which country does the Nile start?,نیل در کدام کشور شروع می شود؟
In which state Penn State University is located?,  واقع شده؟  است  دانشگاه  دولت  پن  حالت  که  که در
How large is the area of UK?,  انگلستان؟  از  حوزه  این  است  بزرگ  چطور
Are tree frogs a type of amphibian?,آیا قورباغه های درختی نوعی از دوزیستان هستند؟
how much is the elevation of Düsseldorf Airport ?,  ؟  فرودگاه  دوسلدورف  از  ارتفاع  این  است  خیلی  چطور
How much is the population of mexico city ?,  ؟  شهر  مکزیکو  از  جمعیت  این  است  خیلی  چطور
when was the founding date of french fifth republic?,زمان تاسیس جمهوری پنجم فرانسه کی بود؟
Who is the editor of Forbes?,سردبیر فوربس کیست؟
Which awards did Douglas Hofstadter win?,داگلاس هوفستادتر چه جایزه هایی برد؟
Which river does the Brooklyn Bridge cross?,پل بروکلین از کدام رود عبور می کند؟
When was the last episode of the TV series Friends aired?,آخرین قسمت سریال دوستان کی پخش شد؟
Is the wife of president Obama called Michelle?,آیا نام همسر رییس جمهور اوباما میشل است؟
Who is 8th president of US?,  ایالات متحده؟  از  رئيس جمهور  هشتم  است  که
how much is the total population of  european union?,حمعیت کل اتحادیه اروپا چقدر است؟
Give me all launch pads operated by NASA.,نداد  نم  همه  یزادنا هار  دپ  دنک یم راک  طسوت  اسان  
What is the birth name of Adele?,نام تولد آدل چیست؟
What is the population of Cairo?,جمعیت کایرو چند است؟
Is Frank Herbert still alive?,آیا فرانک هربرت هنوز زنده است؟  
What is the last work of Dan Brown?,آخرین کار دان براون چیست؟
Where is Sungkyunkwan University?,  دانشگاه  Sungkyunkwan  است  جایی که
Who is the author of the interpretation of dreams?,  رویاها  از  تفسیر  این  از  نویسنده  این  است  که
When was the death  of  Shakespeare?,  شکسپیر؟  از  مرگ  این  بود  چه زمانی
Where is the origin of Carolina reaper?,  درو باز؟  کارولینا  از  اصل و نسب  این  است  جایی که
Was the wife of president Lincoln called Mary?,آیا نام همسر رئيس جمهور لینکلن ماری بود؟
In which programming language is GIMP written?,GIMP به چه زبان برنامه نویسی نوشته شده است؟
Who was the wife of U.S. president Lincoln?,همسر رئیس جمهور آمریکا لینکلن که بود؟
Which species does an elephant belong?,  تعلق داشتن؟  فیل  یک  میکند  گونه ها  کدام
How many people live in the capital of Australia?,چه تعداد انسان در پایتخت استرالیا زندگی می کنند؟
With how many countries Iran has borders?,  مرز ها؟  دارای  ایران  کشورها  بسیاری  چطور  با
Who was the successor of John F. Kennedy?,جانشین جان اف کندی که بود؟
Did Arnold Schwarzenegger attend a university?,ایآ  دلونرآ  رگنزتراوش  ندرك هعجارم  a  ؟هاگشناد  
Does the Isar flow into a lake?,آیا ایسار در یک رودخانه افتاد؟
Who was John F. Kennedy's vice president?,معاون جان اف کندی که بود؟
Which country does the creator of Miffy come from?,خالق Miffy اهل چه کشوری است؟
List the children of Margaret Thatcher.,بچه های مارگارت تاچر را لیست کن.
From which region is the Melon de Bourgogne?,خربزه بورگوندی از چه منطقه ای است؟
how big is the total area of North Rhine- Westphalia?,  وستفالن؟  راین-  شمال  از  حوزه  جمع  این  است  بزرگ  چطور
Which city has the most inhabitants?,کدام شهر بیشترین ساکن را دارد؟
What is Donald Trump's main business?,  کسب و کار؟  اصلی  Trump است  دونالد  است  چی
When will start the final match of the football world cup 2018?,  2018؟  فنجان  جهان  فوتبال  این  از  همخوانی داشتن  نهایی  این  شروع کن  اراده  چه زمانی
how much is the population  Iraq?,  عراق؟  جمعیت  این  است  خیلی  چطور
How many inhabitants does the largest city in Canada have?,بزرگترین شهر کانادا چه تعداد ساکن دارد؟
Who is the mayor of the capital of French Polynesia?,شهردار پایتخت پلی نزی فرانسه کیست؟
How tall is Claudia Schiffer?,قد کلودیا شیفر چقدر است؟
how much is the population densty rank of germany?,  آلمان؟  از  رتبه بندی  چگالی  جمعیت  این  است  خیلی  چطور
What is the highest mountain in Italy?,یچ  تسا  نیا  نیرتالاب  هوک  رد هک  ؟ایلاتیا  
List all games by GMT.,تسرهف  همه  اه یزاب  طسوت  TMG  
What is the official language of Suriname?,یچ  تسا  نیا  یمسر  نابز  زا  ؟مانیروس  
In which country is the Limerick Lake?,رد هک  هک  روشک  تسا  نیا  کیرمیال  هچایرد  
Give me all video games published by Mean Hamster Software.,نداد  نم  همه  وئدیو  اه یزاب  هدش رشتنم  طسوت  نتشاد روظنم  رتسماه  .رازفا مرن  
Who are the writers of the Wall album of Pink Floyd?,  فلوید؟  رنگ صورتی  از  آلبوم  دیوار  این  از  نویسندگان  این  هستند  که
Who is the mayor of Rotterdam?,  روتردام؟  از  شهردار  این  است  که
What is the largest city in Australia?,  استرالیا؟  که در  شهر  بزرگترین  این  است  چی
Who was married to president Chirac?,  شیراک؟  رئيس جمهور  به  متاهل  بود  که
How high is the Yokohama Marine Tower?,  برج؟  دریایی  یوکوهاما  این  است  بالا  چطور
Did Che Guevara have children?,  فرزندان؟  دارند  گوارا  که  آیا
Is Christian Bale starring in Velvet Goldmine?,  معدن طلا؟  مخملی  که در  بازیگران  بیل  مسیحی  است
Was Natalie Portman born in the United States?,  ایالت ها؟  یونایتد  این  که در  بدنیا آمدن  پورتمن  ناتالی  بود
How many pages does War and Peace have?,  دارند؟  صلح  و  جنگ  میکند  صفحات  بسیاری  چطور
Who is the oldest child of Meryl Streep?,  استریپ؟  مریل  از  کودک  قدیمی ترین  این  است  که
Which television shows were created by Walt Disney?,  دیزنی؟  والت  توسط  ایجاد شده  بود  نشان می دهد  تلویزیون  کدام
What does IYCM stand for?,  برای؟  ایستادن  چشمان شما  میکند  چی
Was U.S. president Jackson involved in a war?,  جنگ  a  که در  گرفتار  جکسون  رئيس جمهور  ایالات متحده  بود
When was the Titanic completed?,  تکمیل شده  تایتانیک  این  بود  چه زمانی
Did Tesla win a nobel prize in physics?,  فیزیک؟  که در  جایزه  نوبل  a  پیروزی  تسلا  آیا
Which scientist is known for the Manhattan Project and the Nobel Peace Prize?,  جایزه؟  صلح  نوبل  این  و  پروژه  منهتن  این  برای  شناخته شده  است  دانشمند  کدام
Who composed the music for Harold and Maude?,  ماد؟  و  هارولد  برای  موسیقی  این  تشکیل شده  که
List all episodes of the first season of the HBO television series The Sopranos.,  سوپرانو  این  سلسله  تلویزیون  HBO  این  از  فصل  اولین  این  از  قسمت ها  همه  فهرست
Who wrote the book The Pillars of the Earth?,  زمین؟  این  از  ستون ها  این  کتاب  این  نوشت  که
Do Prince Harry and Prince William have the same parents?,  والدین؟  یکسان  این  دارند  ویلیام  شاهزاده  و  هری  شاهزاده  انجام دادن
Does Breaking Bad have more episodes than Game of Thrones?,  پادشاهان  از  بازی  از  قسمت ها  بیشتر  دارند  بد  شکستن  میکند
Is proinsulin a protein?,  پروتئین  a  پروینسولین  است
Is Lake Baikal bigger than the Great Bear Lake?,  دریاچه  خرس  عالی  این  از  بزرگتر  باکال  دریاچه  است
Where was Bach born?,  بدنیا آمدن؟  باچ  بود  جایی که
Who designed the Brooklyn Bridge?,  پل  بروکلین  این  طراحی شده  که
"What is the total population of Melbourne, Florida?",  فلوریدا؟  ملبورن  از  جمعیت  جمع  این  است  چی
What country is Mount Everest in?,  که در؟  اورست  کوه  است  کشور  چی
What is the bridge with the longest span?,  طول؟  طولانی ترین  این  با  پل  این  است  چی
Is there a video game called Battle Chess?,  شطرنج؟  نبرد  به نام  بازی  ویدئو  a  آنجا  است
Did Socrates influence Aristotle?,  ارسطو؟  نفوذ  سقراط  آیا
How tall is Michael Jordan?,  اردن؟  مایکل  است  بلند قد  چطور
In which UK city are the headquarters of the MI6?,  MI6  این  از  مرکز فرماندهی  این  هستند  شهر  انگلستان  که  که در
When did the Ming dynasty dissolve?,  حل کن  سلسله  مینگ  این  انجام داد  چه زمانی
In which military conflicts did Lawrence of Arabia participate?,  شرکت کردن؟  عربستان  از  لارنس  انجام داد  درگیری ها  نظامی  که  که در
Give me all books by William Goldman with more than 300 pages.,  صفحات  300  از  بیشتر  با  گلدمن  ویلیام  توسط  کتاب ها  همه  من  دادن
What did Bruce Carver die from?,  از جانب؟    کارور  بروس  انجام داد  چی
Which subsidiary of Lufthansa serves both Dortmund and Berlin Tegel?,  تگل؟  برلین  و  دورتموند  هر دو  خدمت  لوفت هانزا  از  شرکت تابعه  کدام
Does Abraham Lincoln's death place have a website?,  سایت اینترنتی؟  a  دارند  محل  مرگ  لینکلن  ابراهیم  میکند
Is Michelle Obama the wife of Barack Obama?,  اوباما؟  باراک  از  همسر  این  اوباما  میشل  است
What is the capital of Canada?,  کانادا؟  از  سرمایه، پایتخت  این  است  چی
Who is the mayor of Tel Aviv?,  آویو؟  تلفن  از  شهردار  این  است  که
Show me the book that Muhammad Ali wrote.,  نوشت.  اما  محمد  آن  کتاب  این  من  نمایش
Who was the first to climb Mount Everest?,  اورست؟  کوه  بالا رفتن  به  اولین  این  بود  که
What is the currency of the Czech Republic?,  جمهوری  کشور چک  این  از  واحد پول  این  است  چی
Where in France is sparkling wine produced?,  تولید شده؟  شراب  درخشان  است  فرانسه  که در  جایی که
Give me all Canadian Grunge record labels.,  برچسب ها.  رکورد  گرانج  کانادایی  همه  من  دادن
In which country does the Ganges start?,  شروع کن  گنگ  این  میکند  کشور  که  که در
Who is the founder of Penguin Books?,  کتاب ها؟  پنگوئن  از  موسس  این  است  که
In which city did John F. Kennedy die?,  است؟  کندی  F.  جان  انجام داد  شهر  که  که در
What is the highest mountain in Australia?,  استرالیا؟  که در  کوه  بالاترین  این  است  چی
Give me the currency of China.,  چين  از  واحد پول  این  من  دادن
Give me all Swedish oceanographers.,  اقیانوس شناسان  سوئدی  همه  من  دادن
Is Rita Wilson the wife of Tom Hanks?,  هانکس؟  تام  از  همسر  این  ویلسون  ریتا  است
Which of Tim Burton's films had the highest budget?,  بودجه؟  بالاترین  این  داشته است  فیلم های  بورتون  تیم  از  کدام
Give me all actors starring in Last Action Hero.,  قهرمان  عمل  آخر  که در  بازیگران  بازیگران  همه  من  دادن
