input_lang,output_lang
Give me all cosmonauts.,تمام فضانوردان روس را لیست کن.
In which country does the Ganges start?,گنگ از کدام کشور شروع می شود؟
When is the movie Worst Case Scenario going to be in cinemas in the Netherlands?,فیلم ورست کیس سناریو از کی در هلند نمایش داده خواهد شد؟
Which German cities have more than 250000 inhabitants?,چه شهرهایی در آلمان بیشتر از 250000 نفر سکنه دارند؟
Who was John F. Kennedy's vice president?,چه کسی معاون جان اف. کندی بود؟
Who is the mayor of Tel Aviv?,چه کسی شهردار تلاویو است؟
How many students does the Free University in Amsterdam have?,دانشگاه آزاد در آمستردام چه تعداد دانشجو دارد؟
What is the second highest mountain on Earth?,دومین کوه بلند روی زمین کدام است؟
Give me all professional skateboarders from Sweden.,تمام اسکیت بازهای حرفه ای اهل سوئد را لیست کن.
When was Alberta admitted as province?,کی آلبرتا به عنوان استان پذیرفته شد؟
To which countries does the Himalayan mountain system extend?,رشته کوه هیمالیا در چه کشورهایی امتداد دارد؟
Give me a list of all bandleaders that play trumpet.,تمام رهبران گروه که ترومپت می نوازند را لیست کن.
Which countries have more than ten caves?,چه کشورهایی بیشتر از ده غار دارند؟
What is the total amount of men and women serving in the FDNY?,تعداد کل مردان و زنان شاغل در سازمان آتش نشانی نیویورک چقدر است؟
Who produces Orangina?,چه کسی اورنجینا را تولید می کند؟
Who is the Formula 1 race driver with the most races?,چه کسی راننده فرمول 1 با بیشترین مسابقه است؟
Give me all world heritage sites designated within the past two years.,میراث جهانی که در طول دو سال گذشته ثبت شده اند را لیست کن.
Who is the youngest player in the Premier League?,[چه کسی جوان ترین بازیکن لیگ برتر است؟
Give me all members of Prodigy.,تمام اعضای پرادیجی را لیست کن.
What is the longest river?,طولانی ترین رود کدام است؟
Does Breaking Bad have more episodes than Game of Thrones?,آیا بریکینگ بد از گیم آف ترونز قسمت های بیشتری دارد؟
Give me all cars that are produced in Germany.,تمام خودروهایی که در آلمان تولید می شوند را لیست کن.
What were the main discoveries of the Mars rover Curiosity?,مهم ترین کشف های مریخ نورد کوریوسیتی چه بود؟
Give me all people that were born in Vienna and died in Berlin.,تمام افرادی که در وین متولد شدند و در برلین مردند را لیست کن.
Is proinsulin a protein?,آیا پروینسولین یک پروتئین است؟
How tall is Michael Jordan?,قد مایکل جردن چقدر است؟
What is the capital of Canada?,پایتخت کانادا کجاست؟
Who is the governor of Wyoming?,چه کسی فرماندار وایومینگ است؟
Do Prince Harry and Prince William have the same parents?,آیا شاهزاده هری و شاهزاده ویلیام والدین یکسان دارند؟
Who was the father of Queen Elizabeth II?,چه کسی پدر ملکه الیزابت دوم بود؟
Which U.S. state has been admitted latest?,آخرین ایالت ثبت شده ایالات متحده کدام است؟
How many languages are spoken in Turkmenistan?,چند زبان در ترکمنستان صحبت می شود؟]
Butch Otter is the governor of which U.S. state?,بوچ اوتر فرماندار کدام ایالت ایالات متحده است؟
Give me all movies directed by Francis Ford Coppola.,تمام فیلم های کارگردانی شده توسط فرانسیس فورد کوپولا را لیست کن.
Give me all actors starring in movies directed by William Shatner.,تمام بازیگرانی که در فیلم های کارگردانی شده توسط ویلیام شاتنر بازی کرده اند را لیست کن.
Are tree frogs a type of amphibian?,آیا قورباغه های درختی نوعی دوزیست هستند؟
What is the birth name of Angela Merkel?,نام قبل از ازدواج آنگلا مرکل چیست؟
Give me all Methodist politicians.,تمام سیاستمداران متدیست را لیست کن.
How often did Jane Fonda marry?,جین فوندا چند بار ازدواج کرد؟
Give me all Australian nonprofit organizations.,تمام سازمان های ناسودبر استرالیایی را لیست کن.
In which military conflicts did Lawrence of Arabia participate?,در چه درگیرهای نظامی لورنس عربستان شرکت کرد؟
Who developed Minecraft?,چه کسی ماینکرفت را ساخت؟
What is the melting point of copper?,نقطه ذوب مس چند است؟
Give me all sister cities of Brno.,تمام شهرهای خواهر برنو را لیست کن.
How many inhabitants does Maribor have?,ماریبور چه تعداد سکنه دارد؟
Give me all companies in Munich.,تمام شرکت های مونیخ را لیست کن.
How tall is Amazon Eve?,قد آمازون ایو چقدر است؟
List all games by GMT.,تمام بازی های جی.ام.تی را لیست کن.
Who founded Intel?,چه کسی اینتل را تاسیس کرد؟
Who is the husband of Amanda Palmer?,چه کسی شوهر آماندا پالمر است؟
Give me all breeds of the German Shepherd dog.,تمام گونه های سگ ژرمن شپرد را لیست کن.
Which cities does the Weser flow through?,وزر از چه شهرهایی می گذرد؟
Which countries are connected by the Rhine?,چه کشورهایی توسط راین به هم متصل شده اند؟
Which professional surfers were born in Australia?,چه موج سواران حرفه ای در استرالیا متولد شدند؟
What is the average temperature on Hawaii?,میانگین دما در هاوایی چقدر است؟
In which UK city are the headquarters of the MI6?,مقر ام.آی.6 در کدام شهر بریتانیا است؟
Which weapons did Heckler & Koch develop?,هکلر و کخ جه سلاح هایی را ساخت؟
Who created Goofy?,چه کسی گوفی را ساخت؟
Was the Cuban Missile Crisis earlier than the Bay of Pigs Invasion?,آیا بحران موشکی کوبا قبل از عملیات خلیج خوک ها بود؟
Give me all islands that belong to Japan.,تمام جزایر متعلق به ژاپن را لیست کن.
Who invented the zipper?,زیپ را چه کسی اختراع کرد؟
What is the ruling party in Lisbon?,حزب حاکم در لیسبون کدام است؟
What are the nicknames of San Francisco?,اسم های مستعار سانفرانسیسکو چیست؟
Which Greek goddesses dwelt on Mount Olympus?,کدام الهه یونان در کوه المپ سکنی داشت؟
When were the Hells Angels founded?,هلس آنگلس کی تاسیس شد؟
Give me all Apollo 14 astronauts.,تمام فضانوردان آپولو 14 را لیست کن.
What is the time zone of Salt Lake City?,منطقه زمانی سالت لیک سیتی چیست؟
Which U.S. states are in the same time zone as Utah?,کدام ایالات ایالات متحده در منطقه زمانی یکسان با یوتا هستند؟
Give me the capitals of all countries in Africa.,پایتخت تمام کشورهای آفریقا را لیست کن.
Give me a list of all lakes in Denmark.,تمام دریاچه های دانمارک را لیست کن.
How many missions does the Soyuz programme have?,برنامه سایوز چند ماموریت دارد؟
Did Socrates influence Aristotle?,آیا سقراط ارسطور را تحت تاثیر قرار داد؟
Give me all Danish movies.,تمام فیلم های دانمارکی را لیست کن.
Give me all launch pads operated by NASA.,تمام سکوهای پرتاب راه اندازی شده توسط ناسا را لیست کن.
Which instruments does Cat Stevens play?,کت استیونس چه آلاتی را می نواخت؟
Which ships were called after Benjamin Franklin?,چه کشتی هایی به افتخار بنجامین فرانکلین نام گذاری شدند؟
Who are the parents of the wife of Juan Carlos I?,چه کسانی والدین همسر خوآن کارلوس اول هستند؟
How many employees does Google have?,گوگل چه تعداد کارمند دارد؟
Did Tesla win a nobel prize in physics?,آیا تسلا جایزه نوبل در فیزیک را برد؟
Give me all cities in New Jersey with more than 100000 inhabitants.,تمام شهرهای نیوجرسی که بیشتر از 100000 سکنه دارند را لیست کن.
Is Rita Wilson the wife of Tom Hanks?,آیا ریتا ویلسون همسر تام هنکس است؟
When was the Statue of Liberty built?,کی مجسمه آزادی ساخته شد؟
Where is Fort Knox located?,فورت ناکس در کجا واقع شده است؟
How many children did Benjamin Franklin have?,بنجامین فرانکلین چند فرزند دارد؟
When did Michael Jackson die?,مایکل جکسون کی مرد؟
Which Chess players died in the same place they were born in?,کدام بازکنان شطرنج در همان مکانی مردند که متولد شدند؟
List the children of Margaret Thatcher.,فرزندان مارگارت تاچر را لیست کن.
Who was called Frank The Tank?,چه کسی فرانک د تانک نامیده شد؟
Was Margaret Thatcher a chemist?,آیا مارگارت تاچر یک شیمیدان بود؟
Was Marc Chagall a jew?,آیا مارک شاگل یک یهودی بود؟
Which museum exhibits The Scream by Munch?,کدام موزه فریاد اثر مونک را نمایش می دهد؟
Give me all books by William Goldman with more than 300 pages.,تمام کتاب های اثر ویلیام گولدمن با بیشتر از 300 صفحه را لیست کن.
Which books by Kerouac were published by Viking Press?,چه کتاب هایی اثر کرواک توسط انتشارات وایکینگ منتشر شدند؟
Give me a list of all American inventions.,تمام اختراعات آمریکایی را لیست کن.
How high is the Mount Everest?,ارتفاع کوه اورست چقدر است؟
Who created Batman?,چه کسی بتمن را ساخت؟
How many people live in the capital of Australia?,چند نفر در پایتخت استرالیا زندگی می کنند؟
What is the largest city in Australia?,بزرگترین شهر استرالیا کدام است؟
Who composed the music for Harold and Maude?,چه کسی موسیقی هرولد و موده را نوشت؟
Which films starring Clint Eastwood did he direct himself?,کلینت ایستوود در چه فیلمی که خودش کارگردانی کرد بازی کرد؟
In which city was the former Dutch queen Juliana buried?,ملکه سابق هلند یویلیانا در کدام شهر دفن شد؟
Is Egypts largest city also its capital?,آیا بزرگترین شهر مصر پایتخت آن هم هست؟
Where is the residence of the prime minister of Spain?,محل سکونت نخست وزیر اسپانیا کجاست؟
Which U.S. state has the abbreviation MN?,مخفف کدام ایالت ایالات متحده ام.ان. است؟
Show me all songs from Bruce Springsteen released between 1980 and 1990.,تمام آهنگ های اثر بروس اسپرینگستین را که بین 1980 و 1990 منتشر شدند را لیست کن.
Which movies did Kurosawa direct?,کوروساوا چه فیلم هایی را کارگردانی کرد؟
What is the founding year of the brewery that produces Pilsner Urquell?,سال تأسیس کارخانه آبجوسازی که پیلزنر اورکوئل را تولید می کند چیست؟
Who wrote the lyrics for the Polish national anthem?,شعر سرود ملی لهستان را چه کسی نوشت؟
Give me all B-sides of the Ramones.,تمام بیسایدهای رامونز را لیست کن.
Who painted The Storm on the Sea of Galilee?,چه کسی طوفان در دریای جلیله را نقاشی کرد؟
Which country does the creator of Miffy come from?,سازنده میفی اهل کدام کشور است؟
For which label did Elvis record his first album?,الویس اولین آلبوم خود را با کدام ناشر موسیقی ضبط کرد؟
Give me the birthdays of all actors of the television show Charmed.,تاریخ تولد تمام بازیگران نمایش تلویزیونی چارمد را لیست کن.
How many employees does IBM have?,آی.بی.آم. چند کارمند دارد؟
Which states border Illinois?,ایلینوی با چه ایالت هایی هم مرز است؟
In which country is the Limerick Lake?,دریاچه لیمریک در کدام کشور است؟
Which television shows were created by John Cleese?,چه نمایش های تلویزیونی توسط جان کلیز ساخته شدند؟
Which mountain is the highest after the Annapurna?,بلندترین کوه پس از آناپورنا چیست؟
In which films directed by Garry Marshall was Julia Roberts starring?,در چه فیلمی که توسط گری مارشال کارگردانی شد جولیا رابرتس بازی کرد؟
Which bridges are of the same type as the Manhattan Bridge?,چه پل هایی هم نوع پل منهتن هستند؟
Was U.S. president Jackson involved in a war?,آیا رئیس جمهور ایالات متحده جکسون درگیر جنگی شد؟
Give me all communist countries.,تمام کشورهای کمونیست را لیست کن.
Which awards did Douglas Hofstadter win?,داگلاس هافستادر چه جایزه هایی را برد؟
Who is the daughter of Robert Kennedy married to?,دختر رابرت کندی با چه کسی ازدواج کرده است؟
Which U.S. state has the highest population density?,کدام ایالت ایالات متحده بیشترین تراکم جمعیت را دارد؟
What is the currency of the Czech Republic?,واحد پول جمهوری چک چیست؟
Which countries adopted the Euro?,کدام کشورها یورو را قبول کردند؟
What is the area code of Berlin?,پیش شماره برلین چند است؟
Which countries have more than two official languages?,چه کشورهایی بیش از دو زبان رسمی دارند؟
Who is the owner of Rolls-Royce?,چه کسی مالک رولز-رویس است؟
Through which countries does the Yenisei river flow?,رود ینی سئی از چه کشورهایی می گذرد؟
When did Latvia join the EU?,لتونی کی به اتحادیه اروپا پیوست؟
Which politicians were married to a German?,چه سیاستمدارانی با یک آلمانی ازدواج کردند؟
When was the Battle of Gettysburg?,نبرد گتیسبورگ کی رخ داد؟
Which river does the Brooklyn Bridge cross?,پل بروکلین از روی چه رودی می گذرد؟
What is the highest mountain in Australia?,مرتفع ترین کوه در استرالیا چیست؟
Give me all soccer clubs in Spain.,تمام باشگاه های فوتبال در اسپانیا را لیست کن.
What is the official language of Suriname?,زبان رسمی سورینام چیست؟
Who is the mayor of Tel Aviv?,چه کسی شهردار تل آویو است؟
Who designed the Brooklyn Bridge?,چه کسی پل بروکلین را طراحی کرد؟
Which telecommunications organizations are located in Belgium?,چه سازمان های مخابراتی در بلژیک واقع شده اند؟
Is Frank Herbert still alive?,آیا فرانک هربرت هنوز زنده است؟
What is the highest place of the Urals?,بالاترین نقطه در اورال کجاست؟
Who is the editor of Forbes?,ویراستار فوربز کیست؟
Give me all companies in the advertising industry.,تمام شرکت هایی که در صنعت تبلیغات فعال هستند را لیست کن.
How many countries are there in Europe?,چه تعداد کشور در اروپا هستند؟
What did Bruce Carver die from?,بروس کارور در اثر چه چیزی فوت کرد؟
Give me all libraries established earlier than 1400.,تمام کتاب خانه هایی که قبل از 1400 تأسیس شدند را لیست کن.
Which presidents were born in 1945?,چه رئیس جمهورهایی در 1945 متولد شدند؟
Give me all federal chancellors of Germany.,تمام صدراعظم های آلمان را لیست کن.
Who was the wife of U.S. president Lincoln?,چه کسی همسر رئیس جمهور ایالات متحده لینکلن بود؟
Who developed the video game World of Warcraft?,چه کسی بازی ویدئویی ورلد آف وارکرافت را ساخت؟
What is the official website of Tom Cruise?,وبسایت رسمی تام کروز چیست؟
List all episodes of the first season of the HBO television series The Sopranos.,تمام قسمت های فصل اول سریال تلویزیونی سوپرانوز متعلق به اچ.بی.او را لیست کن.
Who produced the most films?,چه کسی بیشترین تعداد فیلم را تولید کرده است؟
Give me all people with first name Jimmy.,تمام افرادی که اسم کوچک آنها جیمی است را لیست کن.
In which city did John F. Kennedy die?,جان اف. کندی در کدام شهر فوت کرد؟
Is there a video game called Battle Chess?,آیا بازی ویدئویی به نام بتل چس وجود دارد؟
Which mountains are higher than the Nanga Parbat?,چه کوه هایی از نانگا پاربات بلندتر هستند؟
Who created Wikipedia?,چه کسی ویکی پدیا را ساخت؟
Give me all actors starring in Last Action Hero.,تمام بازیگرانی که در لست اکشن هیرو بازی کردند را لیست کن.
Which software has been developed by organizations founded in California?,چه نرم افزارهایی توسط سازمان هایی که در کالیفرنیا تأسیس شدند توسعه یافته است؟
Which companies work in the aerospace industry as well as in medicine?,چه شرکت هایی در صنعت هوافضا و نیز پزشکی فعال هستند؟
Is Christian Bale starring in Velvet Goldmine?,آیا کریستین بیل در ولوت گولدماین بازی می کند؟
Give me the websites of companies with more than 500000 employees.,وبسایت شرکت های با بیش از 500000 کارمند را لیست کن.
Which actors were born in Germany?,چه بازیگرانی در آلمان متولد شدند؟
Which caves have more than 3 entrances?,چه غارهایی بیشتر از 3 ورودی دارند؟
Was the wife of president Lincoln called Mary?,آیا همسر رئیس جمهور لینکلن مری نام داشت؟
Give me all films produced by Hal Roach.,تمام فیلم های تولید شده توسط هال روچ را لیست کن.
Give me all video games published by Mean Hamster Software.,تمام بازی های ویدئویی که توسط مین همستر سافتور منتشر شدند را لیست کن.
Which languages are spoken in Estonia?,چه زبان هایی در استونی صحبت می شود؟
How many Aldi stores are there?,چه تعداد فروشگاه آلدی وجود دارد؟
Which capitals in Europe were host cities of the summer olympic games?,چه پایتخت هایی در اروپا شهرهای میزبان بازی های المپیک تابستانی بودند؟
Who was the 16th president of the United States?,چه کسی شانزدهمین رئیس جمهور ایالات متحده بود؟
How many films did Hal Roach produce?,هال روچ چه تعداد فیلم تولید کرد؟
Which music albums contain the song Last Christmas?,کدام آلبوم موسیقی آهنگ لست کریسمس را دارد؟
Give me all books written by Danielle Steel.,تمام کتاب های نوشته شده توسط دانیل استیل را لیست کن.
"Which airports are located in California, USA?",چه فرودگاه هایی در کالیفرنیا قرار دارند؟
Which states of Germany are governed by the Social Democratic Party?,در کدام ایالت های آلمان حزب سوسیال دموکرات حاکم است؟
Give me all Canadian Grunge record labels.,تمام ناشران موسیقی گرانج کانادایی را لیست کن.
Which country has the most official languages?,کدام کشور بیشترین زبان رسمی را دارد؟
In which programming language is GIMP written?,گیمپ با چه زبان برنامه نویسی نوشته شده است؟
Who produced films starring Natalie Portman?,چه کسی فیلم هایی با بازی ناتالی پورتمن را تولید کرده است؟
Give me all movies with Tom Cruise.,تمام فیلم های تام کروز را لیست کن.
In which films did Julia Roberts as well as Richard Gere play?,در چه فیلم هایی جولیا رابرتس همچنین ریچارد گییر بازی کردند؟
Give me all female given names.,تمام اسم های دخترانه را لیست کن.
Who wrote the book The Pillars of the Earth?,چه کسی کتاب ستون های زمین را نوشت؟
How many films did Leonardo DiCaprio star in?,لئوناردو دیکاپریو در چند فیلم بازی کرده است؟
Give me all soccer clubs in the Premier League.,تمام باشگاه های فوتبال در لیگ برتر را لیست کن.
In which U.S. state is Mount McKinley located?,کوه مک کینلی در کدام ایالت ایالات متحده واقع شده است؟
When was Jack Wolfskin founded?,جک ولفیش کی تأسیس شد؟
Which organizations were founded in 1930?,چه سازمان هایی در 1930 تأسیس شدند؟]
What is the highest mountain?,بلندترین کوه کدام است؟
Was Natalie Portman born in the United States?,آیا ناتالی پورتمن در ایالات متحده متولد شد؟
Which budget did the first movie of Zdenek Sverak have?,اولین فیلم زندیک سویراک چقدر بودجه داشت؟
How many big fires struck Paris during the Middle Ages?,چند آتش سوزی بزرگ در طول قرون وسطی در پاریس رخ داده است؟
Is Pamela Anderson a vegan?,آیا پاملا اندرسون یک گیاهخوار است؟
How often was Michael Jordan divorced?,مایکل جردن چند بار طلاق گرفته است؟
What is the most beautiful painting?,زیباترین نقاشی کدام است؟
Give me all animal species that live in the Amazon rainforest.,تمام گونه های جانوری که در جنگل انبوه آمازون زندگی می کنند را لیست کن.
How many inhabitants does the largest city in Canada have?,بزرگترین شهر در کانادا چه تعداد سکنه دارد؟
In which studio did the Beatles record their first album?,بیتلز اولین آلبوم خود را در کدام استودیو ضبط کردند؟
Who was the first to climb Mount Everest?,چه کسی برای اولین بار قله اورست را فتح کرد؟
How many programming languages are there?,چه تعداد زبان برنامه نویسی وجود دارد؟
What is the official color of the University of Oxford?,رنگ رسمی دانشگاه آکسفورد چیست؟
How many gold medals did Michael Phelps win at the 2008 Olympics?,مایکل فلپس چه تعداد مدال طلا در المپیک 2008 برد؟
To which artistic movement did the painter of The Three Dancers belong?,نقاش سه رقصنده به چه جنبش هنری تعلق دارد؟
Give me all animals that are extinct.,تمام حیواناتی که منقرض شده اند را لیست کن.
Does Abraham Lincoln's death place have a website?,آیا محل مرگ آبراهام لینکلن وبسایت دارد؟
How deep is Lake Chiemsee?,دریاچه چیمسی چقدر عمیق است؟
Give me the grandchildren of Elvis Presley.,نوه های الویس پرسلی را لیست کن.
Who is the youngest Darts player?,چه کسی جوان ترین بازیکن دارت است؟
Where was Bach born?,باخ کجا متولد شد؟
In which countries can you pay using the West African CFA franc?,در کدام کشورها شما می توانید از فرانک سی.اف.ای. آفریقای غربی برای پرداخت استفاده کنید؟
What are the top-10 action role-playing video games according to IGN?,10 بازی ویدئویی نقش آفرینی اکشن برتر بر اساس آی.جی.ان. کدام است؟
What is the most frequent cause of death?,شایع ترین علت مرگ چیست؟
Does the Isar flow into a lake?,آیا ایسار به یک دریاچه می ریزد؟
Give me all films produced by Steven Spielberg with a budget of at least $80 million.,تمام فیلم های تولید شده توسط استیون اسپیلبرگ با بودجه حداقل 80 میلیون دلار را لیست کن.
Give me all writers that won the Nobel Prize in literature.,تمام نویسندگانی که جایزه نوبل در ادبیات را بردند لیست کن.
Give me all taikonauts.,تمام فضانوردان چینی را لیست کن.
How many pages does War and Peace have?,جنگ و صلح چند صفحه دارد؟
