input_lang,output_lang
What is the bridge with the longest span?,کدام پل بیشترین طول را دارد؟
Give me all actors called Baldwin.,تمام بازیگران با نام بالدوین را لیست کن.
Who is the tallest player of the Atlanta Falcons?,بلندترین بازیکن آتلانتا فالکون کیست؟
Which rivers flow into a German lake?,کدام رودها به یک دریاچه آلمانی می ریزند؟
How many James Bond movies are there?,چه تعداد فیلم جیمز باند موجود است؟
Which rockets were launched from Baikonur?,چه راکت هایی از بایکونور پرتاب شدند؟
Which pope succeeded John Paul II?,چه پاپی جانشین ژان پل دوم شد؟
Give me all Dutch parties.,تمام حزب های هلندی را لیست کن.
When is Halloween?,چه زمانی هالووین است؟
Give me all Swedish oceanographers.,تمام اقیانوس شناسان سوئدی را لیست کن.
Give me all actors who were born in Berlin.,تمام بازیگرانی که در برلین متولد شدند را لیست کن.
What was the last movie with Alec Guinness?,آخرین فیلم الک گینس چه بود؟
Which poet wrote the most books?,کدام شاعر بیشترین کتاب را نوشته است؟
How many languages are spoken in Colombia?,چه تعداد زبان در کلمبیا صحبت می شود؟
What does ICRO stand for?,آی.سی.آر.او. مخفف چیست؟
What was Brazil's lowest rank in the FIFA World Ranking?,پایین ترین رتبه برزیل در رتبه بندی جهانی فیفا چیست؟
Give me the capitals of all countries that the Himalayas run through.,پایتخت تمام کشورهایی که هیمالیا از آنها می گذرد را لیست کن.
Which actor played Chewbacca?,کدام بازیگر نقش چوباکا را بازی کرد؟
Which ingredients do I need for carrot cake?,چه مواد اولیه ای را من برای کیک هویج نیاز دارم؟
Is Cola a beverage?,آیا کولا یک نوشیدنی است؟
Who has Tom Cruise been married to?,تام کروز با چه کسی ازدواج کرده است؟
Which of Tim Burton's films had the highest budget?,کدام فیلم تیم برتون بیشترین بودجه را داشته است؟
How heavy is Jupiter's lightest moon?,سبک ترین قمر مشتری چقدر سنگین است؟
Which actor was casted in the most movies?,کدام بازیگر در بیشترین تعداد فیلم بازی کرده است؟
Is James Bond married?,آیا جیمز باند ازدواج کرده است؟
Give me all Australian metalcore bands.,تمام باندهای متال کور استرالیایی را لیست کن.
Give me all actors who were born in Paris after 1950.,تمام بازیگرانی که پس از 1950 در پاریس متولد شدند را لیست کن.
When was Olof Palme shot?,چه زمانی اولاف پالمه گلوله خورد؟
Who are the four youngest MVP basketball players?,چه کسانی چهار بازیکن بسکتبال جوان تر ام.وی.پی هستند؟
Which companies have more than 1 million employees?,چه شرکت هایی بیشتر از 1 میلیون کارمند دارند؟
Give all swimmers that were born in Moscow.,تمام شناگرهایی که در مسکو متولد شدند را لیست کن.
Who was called Rodzilla?,چه کسی رودزیلا نامیده شد؟
Show me the book that Muhammad Ali wrote.,کتابی را که محمد علی نوشت را به من نشان بده
How many museums does Paris have?,پاریس چند موزه دارد؟
Which city has the most inhabitants?,چه شهری بیشترین سکنه را دارد؟
Which city has the least inhabitants?,چه شهری کمترین سکنه را دارد؟
Give me all the TV shows with Neil Patrick Harris.,تمام نمایش های تلویزیونی با نیل پاتریک هریس را لیست کن.
Who wrote The Hunger Games?,چه کسی هانگر گیمز را نوشت؟
Show a list of soccer clubs that play in the Bundesliga.,لیستی از باشگاه های فوتبال که در بوندسلیگا بازی می کنند را نمایش بده.
What country is Mount Everest in?,کوه اورست در کدام کشور است؟
Who is the founder of Penguin Books?,چه کسی مؤسس پنگوئن بوکز است؟
Which programming languages influenced Javascript?,چه زبان های برنامه نویسی بر جاوااسکریپت تأثیر گذاشت؟
Did Che Guevara have children?,آیا چه گوارا فرزند داشت؟
List all the musicals with music by Leonard Bernstein.,تمام فیلم های موزیکال با موسیقی لئونارد برنستاین را لیست کن.
Show me all the breweries in Australia.,تمام آبجوسازی های استرالیا را لیست کن.
When was the Titanic completed?,چه زمانی تایتانیک کامل شد؟
How much did Pulp Fiction cost?,پالپ فیکشن چقدر هزینه داشت؟
How many airlines are there?,چند خط هوایی وجود دارد؟
Who played Agent Smith in Matrix?,چه کسی مأمور اسمیت را در ماتریکس بازی کرد؟
How much carbs does peanut butter have?,کره بادام زمینی چقدر کربوهیدرات دارد؟
Which book has the most pages?,چه کتابی بیشترین صفحه را دارد؟
Which bridges cross the Seine?,چه پل هایی از سن می گذرند؟
Who is the mayor of the capital of French Polynesia?,چه کسی شهردار پایتخت پلی نزی فرانسه است؟
When did Dracula's creator die?,چه زمانی خالق دراکولا فوت کرد؟
What is the location of the Houses of Parliament?,مکان کاخ وستمینستر کجاست؟
Show me all English Gothic buildings in Kent.,تمام ساختمان های به سبک گوتیک انگلیسی در کنت را لیست کن.
Who was the pope that founded the Vatican Television?,کدام پاپ تلویزیون واتیکان را تأسیس کرد؟
What airlines are part of the SkyTeam alliance?,چه خطوط هوایی عضو اتحاد اسکایتیم هستند؟
"What is the total population of Melbourne, Florida?",جمعیت کل ملبورن، فلوریدا چقدر است؟
Which airports does Yeti Airlines serve?,یتی ایرلاینرز در چه فرودگاه هایی فعالیت می کند؟
In which year was Rachel Stevens born?,ریچل استیونز در چه سالی متولد شد؟
Where was JFK assassinated?,[جان کندی کجا ترور شد؟
How many politicians graduated from Columbia University?,چه تعداد سیاستمدار از دانشگاه کلمبیا فارغ التحصیل شدند؟
Which scientist is known for the Manhattan Project and the Nobel Peace Prize?,کدام دانشمند بخاطر پروژه منهتن و جایزه صلح نوبل شناخته شده است؟
What is the highest volcano in Africa?,بلندترین آتش فشان در آفریقا کدام است؟
Which beer originated in Ireland?,منشأ کدام آبجو ایرلند است؟
What are the specialities of the UNC Health Care?,تخصص های UNC Health Care چیست؟
Who is the owner of Facebook?,چه کسی مالک فیسبوک است؟
From which region is the Melon de Bourgogne?,Melon de bourgogne از چه منطقه ای است؟
Who was influenced by Socrates?,چه کسانی تحت تأثیر سقراط بودند؟
Who was president of Pakistan in 1978?,رئیس جمهور پاکستان در 1978 چه کسی بود؟
Give me English actors starring in Lovesick.,بازیگران انگلیسی که در Lovesick بازی کردند را لیست کن.
Give me all types of eating disorders.,تمام انواع اختلالات غذا خوردن را لیست کن.
Who was married to president Chirac?,چه کسی با رئیس جمهور شیراک ازدواج کرد؟
What is the largest metropolitan area in Washington state?,بزرگترین منطقه شهری در ایالت واشنگتن چیست؟
Where in France is sparkling wine produced?,شراب گازدار در کجای فرانسه تولید می شود؟
Where did Hillel Slovak die?,کجا هیلل اسلووک فوت کرد؟
What is the timezone in San Pedro de Atacama?,منطقه زمانی در San Pedro de Atacama چیست؟
In which city does the Chile Route 68 end?,در کدام شهر مسیر 68 شیلی پایان می یابد؟
Give me all ESA astronauts.,تمام فضانوردان ایی.اس.ای را لیست کن.
Give me all Swedish holidays.,تمام تعطیلات سوئدی را لیست کن.
Who is the youngest Pulitzer Prize winner?,چه کسی جوان ترین برنده جایزه پولیتزر است؟
Which animals are critically endangered?,چه جانورانی در معرض خطر انقراض هستند؟
Which soccer players were born on Malta?,چه بازیکنان فوتبالی در مالت متولد شدند؟
Did Arnold Schwarzenegger attend a university?,آیا آرنولد شوارتزنگر در دانشگاهی حضور داشته است؟
Which programming languages were influenced by Perl?,چه زبان های برنامه نویسی تحت تأثیر پرل بودند؟
Is Barack Obama a democrat?,آیا باراک اوباما یک دموکرات است؟
How many children does Eddie Murphy have?,ادی مورفی چند فرزند دارد؟
Who is the oldest child of Meryl Streep?,چه کسی مسن ترین فرزند مریل استریپ است؟
Who killed John Lennon?,چه کسی جان لنون را کشت؟
Which frequent flyer program has the most airlines?,کدام برنامه مسافر هوایی مکرر بیشترین خطوط هوایی را دارد؟
In which city is Air China headquartered?,دفتر مرکزی ایر چاینا در کدام شهر است؟
Which artists were born on the same date as Rachel Stevens?,چه هنرمندانی در تاریخ یکسانی با ریچل استیونز متولد شد؟
How many scientists graduated from an Ivy League university?,چند دانشمند از یک دانشگاه آیوی لیگ فارغ التحصیل شدند؟
Which types of grapes grow in Oregon?,چه انواعی از انگور در اورگن رشد می کند؟
Who is starring in Spanish movies produced by Benicio del Toro?,چه کسی در فیلم های اسپانیایی تولید شده توسط بنیسیو دل تورو بازی می کند؟
Who is the manager of Real Madrid?,چه کسی مدیر رئال مادرید است؟
Give me the currency of China.,پول رایج چین چیست؟
Which movies starring Mickey Rourke were directed by Guy Ritchie?,چه فیلم هایی با بازی میکی رورک توسط گای ریچی کارگردانی شدند؟
Is Darth Vader Luke’s father?,آیا دارت ویدر پدر لوک است؟
How many companies were founded by the founder of Facebook?,چه تعداد شرکت توسط مؤسس فیسبوک تأسیس شدند؟
How many companies were founded in the same year as Google?,چه تعداد شرکت در سال یکسانی با گوگل تأسیس شدند؟
Which subsidiary of TUI Travel serves both Glasgow and Dublin?,چه شرکت های تابعی از تی.یو.آی. تراول به هر دوی گلاسگو و دوبلین سرویس دارند؟
How many airlines are members of the Star Alliance?,چه تعداد خطوط هوایی عضو استار الاینس هستند؟
Give me all spacecrafts that flew to Mars.,تمام فضاپیماهایی که به مریخ پرواز کردند را لیست کن.
Which musician wrote the most books?,کدام موسیقیدان بیشترین کتاب را نوشت؟
Show me everyone who was born on Halloween.,تمام افرادی که در هالووین متولد شدند را لیست کن.
Give me all Swiss non-profit organizations.,تمام سازمان های ناسودبر سویسی را لیست کن.
In which country is Mecca located?,مکه در کدام کشور واقع شده است؟
What is the net income of Apple?,سود خالص اپل چقدر است؟
What does the abbreviation FIFA stand for?,فیفا مخفف چیست؟
When did the Ming dynasty dissolve?,سلسله مینگ کی منحل شد؟
Which museum in New York has the most visitors?,کدام موزه در نیویورک بیشترین بازدید کننده را دارد؟
Is Lake Baikal bigger than the Great Bear Lake?,آیا دریاچه بایکال از دریاچه گریت بر بزرگتر است؟
Desserts from which country contain fish?,دسرهای کدام کشور شامل ماهی است؟
What is the highest mountain in Italy?,بلندترین کوه در ایتالیا چیست؟
Where did the architect of the Eiffel Tower study?,معمار برج ایفل در کجا تحصیل کرد؟
Which Greek parties are pro-European?,کدام احزاب یونانی پرو-یوروپین هستند؟
What is the height difference between Mount Everest and K2?,اختلاف ارتفاع بین کوه اورست و کی2 چقدر است؟
Who is the mayor of Rotterdam?,چه کسی شهردار رتردام است؟
In which city were the parents of Che Guevara born?,والدین چه گوارا در کدام شهر متولد شدند؟
How high is the lighthouse in Colombo?,فانوس دریایی کولومبو چقدر بلند است؟
Are Taiko a kind of Japanese musical instruments?,آیا تایکو یک نوع ابزار موسیقی ژاپنی است؟
How many ethnic groups live in Slovenia?,چند گروه نژادی در اسلوونی زندگی می کنند؟
List the seven kings of Rome.,هفت پادشاه رم را لیست کن.
Who were the parents of Queen Victoria?,چه کسانی والدین ملکه ویکتوریا بودند؟
Who is the heaviest player of the Chicago Bulls?,چه کسی سنگین ترین بازیکن شیکاگو بولز است؟
Which volcanos in Japan erupted since 2000?,چه آتش فشان هایی در ژاپن از سال 2000 به بعد فوران کردند؟
Who is the tallest basketball player?,چه کسی بلندترین بازیکن بسکتبال است؟
Who is the host of the BBC Wildlife Specials?,مجری مجموعه حیات وحش بی.بی.سی چه کسی است؟
In what city is the Heineken brewery?,آبجوسازی هینکن در کدام شهر قرار دارد؟
When did Operation Overlord commence?,نبرد خان بزرگ کی شروع شد؟
Who developed Slack?,اسلک را چه کسی توسعه داد؟
How many seats does the home stadium of FC Porto have?,ورزشگاه باشگاه پورتو چند صندلی دارد؟
Who discovered Ceres?,سرس را چه کسی کشف کرد؟
What is the largest country in the world?,بزرگترین کشور در دنیا کدام است؟
Who is the mayor of Paris?,شهردار پاریس کیست؟
Who is the coach of Ankara's ice hockey team?,سرمربی تیم هاکی آنکارا کیست؟
How much did the Lego Movie cost?,فیلم لگو چقدر هزینه داشت؟
How many people live in Poland?,چند نفر در لهستان زندگی می کنند؟
Who created Family Guy?,چه کسی مرد خانواده را ساخته است؟
Who wrote the song Hotel California?,چه کسی آهنگ هتل کالیفرنیا را نوشت؟
What is in a chocolate chip cookie?,چه چیزهایی در یک کیک شکلاتی هست؟
Does Neymar play for Real Madrid?,آیا نیمار برای رئال مادرید بازی می کند؟
Which computer scientist won an oscar?,کدام دانشمند کامپیوتر اسکار برده است؟
Who played Gus Fring in Breaking Bad?,چه کسی گوستاوو فرینگ را در بریکینگ بد بازی کرد؟
In which ancient empire could you pay with cocoa beans?,در کدام امپراتوری باستانی می توان با دانه های کاکائو داد و ستد کرد؟
Which electronics companies were founded in Beijing?,چه شرکت های الکترونیکی در پکن تأسیس شدند؟
What is the capital of Cameroon?,پایتخت کامرون کجاست؟
What is Batman's real name?,نام واقعی بتمن چیست؟
What form of government does Russia have?,روسیه چه نوع حکومتی دارد؟
Which Indian company has the most employees?,کدام شرکت هندی بیشترین تعداد کارمند را دارد؟
What color expresses loyalty?,چه رنگی وفاداری را بیان می کند؟
Who is the president of Eritrea?,رئیس جمهور اریتره کیست؟
Which films did Stanley Kubrick direct?,چه فیلم هایی را استنلی کوبریک کارگردانی کرده است؟
Who composed the soundtrack for Cameron's Titanic?,چه کسی موسیقی متن تایتانیک کامرون را نوشته است؟
In which time zone is Rome?,رم در چه ناحیه زمانی قرار دارد؟
Who are the developers of DBpedia?,چه کسانی توسعه دهندگان دی.بی.پدیا هستند؟
Who is the king of the Netherlands?,پادشاه هلند کیست؟
In which city did Nikos Kazantzakis die?,نیکوس کازانتزاکیس در کدام کشور مرد؟
Give me a list of all critically endangered birds.,لیستی از پرندگان روبه انقراض را بده.
Which companies produce hovercrafts?,چه شرکت هایی هواناو تولید می کنند؟
Did Elvis Presley have children?,آیا الویس پرسلی فرزند دارد؟
In which city was the president of Montenegro born?,رئیس جمهور مونتنگرو در کدام شهر متولد شد؟
Which country was Bill Gates born in?,بیل گیت در کدام کشور متولد آمد؟
In which countries do people speak Japanese?,در چه کشورهایی مردم ژاپنی صحبت می کنند؟
What was the first Queen album?,اولین آلبوم کوئین چه بود؟
What country is Sitecore from?,سایتکور در کدام کشور تأسیس شد؟
Whom did Lance Bass marry?,لنس بس با چه کسی ازدواج کرده است؟
Who was Vincent van Gogh inspired by?,ونسان ون گوگ از چه کسی الهام گرفته است؟
Who wrote the Game of Thrones theme?,طرح بازی تاج و تخت را چه کسی نوشت؟
When did Boris Becker end his active career?,بوریس بکر کی به فعالیت هنری اش خاتمه داد؟
To which party does the mayor of Paris belong?,شهردار پاریس عضو چه حزبی است؟
Who was the doctoral supervisor of Albert Einstein?,چه کسی استاد راهنمای دکترای آلبرت اینشتین بود؟
In which city does Sylvester Stallone live?,سیلوستر استالونه در کدام شهر زندگی می کند؟
Who is the son of Sonny and Cher?,پسر سونی و چر چه کسی بود؟
In which city are the headquarters of the United Nations?,مقر سازمان ملل در کدام شهر قرار دارد؟
Show me Hemingway's autobiography.,خود زندگی نامه همینگوی را بده.
Did Kaurismäki ever win the Grand Prix at Cannes?,آیا کوریسماکی تا بحال جایزه بزرگ  جشنواره کن را برده است؟
Where is Syngman Rhee buried?,ایسونگمن ری گجا دفن شده است؟
Show me all books in Asimov's Foundation series.,مجموعه کتاب های آسیموف چند کتاب دارد؟
What is the biggest stadium in Spain?,بزرگترین استادیوم در اسپانیا کدام است؟
What are the five boroughs of New York?,پنج منطقه نیویورک کدام است؟
When did princess Diana die?,شاهزاده دیانا کی فوت کرد؟
Are there any castles in the United States?,
Can you find frescoes in Crete?,
Do Urdu and Persian have a common root?,
Does the Ford Motor Company have a manufacturing plant in Malaysia?,
How many years was the Ford Model T manufactured?,
Give me all gangsters from the prohibition era.,
Give me all Seven Wonders of the Ancient World.,
Give me all chemical elements.,
How many rivers and lakes are in South Carolina?,
How many states are in Mexico?,
How many theories did Albert Einstein come up with?,
Is horse racing a sport?,
Is Pluto really a planet?,
Was Sigmund Freud married?,
What form of government is found in South Africa?,
What is the largest state in the United States?,
What is the longest river in the world?,
Which building after the Burj Khalifa has the most floors?,
What is the wavelength of indigo?,
What was the name of the famous battle in 1836 in San Antonio?,
What were the names of the three ships used by Columbus?,
When did Muhammad die?,
When was the De Beers company founded?,
When was John Adams born?,
Which American presidents were in office during the Vietnam War?,
Which city has the oldest running metro?,
Which holidays are celebrated around the world?,
Who assassinated President McKinley?,
Who discovered Pluto?,
Who killed Caesar?,
Who was buried in the Great Pyramid of Giza?,
Who was the first King of England?,
What was the final result of the War of the Roses?,
Who writes the Farmers' Almanac?,
How big is the earth's diameter?,
How many people live in Eurasia?,
Give me the runtime of Toy Story.,
What was the first name of the band Queens of the Stone Age?,
Give me the birth place of Frank Sinatra.,
Which university did Angela Merkel attend?,
List all boardgames by GMT.,همه بازی های تخته ای GMT را لیست کن
Who developed Skype?,توسعه دهنده اسکایپ کیست؟
Which people were born in Heraklion?,چه کسایی در هراکلیون به دنیا آمده اند؟
In which U.S. state is Area 51 located?,ناحیه ۵۱ در کدام ایالت آمریکا قرار دارد؟
Who is the mayor of New York City?,شهردار شهر نیویورک کیست؟  
Which countries have places with more than two caves?, چه کشورهایی مکان هایی با بیش از دو غار دارند؟
Where did Abraham Lincoln die?,آبراهام لینکلن در کجا فوت کرد؟
Which airports does Air China serve?, ایر چاینا را چه فرودگاه هایی ارائه می دهند؟  
Give me all actors starring in movies directed by and starring William Shatner., همه بازیگرانی که در فیلم هایی که ویلیام شاتنر در آن بازی و کارگردانی کرده بازی کرده اند را لیست کن  .
What are the official languages of the Philippines?,زبان های رسمی فیلیپین کدام هستند؟
Give me all Danish films.,همه فیلم های دانمارکی را لیست کن.
Which movies starring Brad Pitt were directed by Guy Ritchie?,چه فیلم هایی که بردپیت بازی کرده توسط گای ریچی کارگردانی شده اند؟
Give me the grandchildren of Bruce Lee.,نوه های بروس لی را لیست کن.
Which other weapons did the designer of the Uzi develop?,طراحان یوزی چه اسلحه های دیگری را توسعه داده اند؟
Who is the owner of Universal Studios?,صاحب یونیورسال استودیوز کیست؟
Which state of the USA has the highest population density?,کدام ایالت آمریکا بیشترین تراکم جمعیت را داد؟
Which monarchs were married to a German?,کدام پادشاهان با یک آلمانی ازدواج کردند؟
Which organizations were founded in 1950?,کدام سازمان ها در سال ۱۹۵۰ تاسیس شده اند؟
Who created the comic Captain America?,چه کسی داستان مصور کاپیتان آمریکا را خلق کرد؟ 
Give me the Apollo 14 astronauts.,  فضانوردان  14  آپولو  این  من  دادن
Who wrote the book The pillars of the Earth?,چه کسی کتاب قطب های زمین را نوشته است؟
Which state of the United States of America has the highest density?,کدام ایالت آمریکا بیشترین تراکم را دارد؟
Which spaceflights were launched from Baikonur?,کدام پرواز فضایی از بایکونور پرتاب شده اند؟
Give me a list of all trumpet players that were bandleaders.,لیست همه نوازنده های ترومپت که رهبر گروه بودند را به من بده.
Which U.S. states are in the same timezone as Utah?,کدام ایالات آمریکا منطقه زمانی مشابه یوتا دارند؟
Which U.S. states possess gold minerals?,کدام ایالات آمریکا مالک مواد معدنی طلا هستند؟
Who is the daughter of Ingrid Bergman married to?,چه کسی با دختر انگرید برگمن ازدواج کرد؟
How deep is Lake Placid?,عمق دریاچه پالاسید جقدر است؟
Show me all museums in London.,تمام موزه های لندن را لیست کن.
Show me all basketball players that are higher than 2 meters.,تمام بازیکنان بسکتبال که بلندتر از 2 متر هستند را لیست کن.
What movies does Jesse Eisenberg play in?,جسی آیزنبرگ در چه فیلم هایی بازی کرده است؟
What kind of music did Lou Reed play?,لو رید چه نوع موسیقی می نواخت؟
Where do the Red Sox play?,رد ساکس در کجا بازی می کند؟
How many movies did Park Chan-wook direct?,پارک چان-ووک چه تعداد فیلم را کارگردانی کرده است؟
Which movies star both Liz Taylor and Richard Burton?,لیز تیلور و ریچارد برتون در چه فیلم هایی هم بازی بوده اند؟
