input_lang,output_lang
When was the Battle of Gettysburg?,गेटिसबर्ग का युद्ध कब हुआ था?
List all the musicals with music by Elton John.,एल्टन जॉन द्वारा संगीत के साथ सभी संगीतों को सूचीबद्ध करें।
How high is the lighthouse in Colombo?,कोलंबो में लाइटहाउस कितना ऊँचा है?
Who was the wife of U.S. president Lincoln?,अमेरिकी राष्ट्रपति लिंकन की पत्नी कौन थी?
Who is the host of the BBC Wildlife Specials?,बीबीसी वाइल्डलाइफ स्पेशल का मेजबान कौन है?
How much did Pulp Fiction cost?,पल्प फिक्शन की लागत कितनी थी?
In what city is the Heineken brewery?,हाइनेकेन शराब की भठ्ठी किस शहर में है?
When did Operation Overlord commence?,ऑपरेशन ओवेरलोर्ड कब शुरू हुआ था?
In which city does the Chile Route 68 end?,चिली रूट 68 का अंत कौनसे शहर में होता है?
Who developed Slack?,कौन ने स्लैक विकसित किया है?
Who was married to president Chirac?,राष्ट्रपति चिराक से किसने विवाह किया था?
What did Bruce Carver die from?,ब्रूस कार्वर कि मृत्यु किस से हुई?
Who painted The Storm on the Sea of Galilee?,किसने गलील के सागर पर द स्टॉर्म को चित्रित किया?
Which cities does the Weser flow through?,किन शहरों से वेसर का प्रवाह होता है?
How many seats does the home stadium of FC Porto have?,एफसी पोर्टो के घर स्टेडियम में कितनी सीटें हैं?
Who is the daughter of Robert Kennedy married to?,रॉबर्ट कैनेडी की बेटी की कौन से शादी हुइ है?
Which books by Kerouac were published by Viking Press?,वाइकिंग प्रेस द्वारा कैरौक की कौन सी किताबें प्रकाशित की गई थीं?
How tall is Amazon Eve?,अमेज़ॅन ईव कितनी लंबी है?
Which museum exhibits The Scream by Munch?,कौन सा संग्रहालय मंच द्वारा द स्क्रीम प्रदर्शित करता है?
Who wrote the book Les Piliers de la terre?,लेस पिलीरेस डी ला टेरे किताब को किसने लिखा है?
Is James Bond married?,क्या जेम्स बांड ने शादी की है?
Who discovered Ceres?,सेरेस की खोज किसने की?
Which river does the Brooklyn Bridge cross?,ब्रुकलिन ब्रिज को कोनसी नदी पार करती है?
Who was called Frank The Tank?,कौनको फ्रैंक द टैंक कहा जाता था?
What is the largest country in the world?,दुनिया का सबसे बड़ा देश क्या है?
Who is the mayor of Paris?,पेरिस का महापौर कौन है?
Who is the coach of Ankara's ice hockey team?,अंकारा के आइस हॉकी टीम का कोच कौन है?
Who is the mayor of the capital of French Polynesia?,फ्रेंच पोलिनेशिया की राजधानी का महापौर कौन है?
Which awards did Douglas Hofstadter win?,डगलस हॉफस्टैडर ने किन पुरस्कारों को जीता है?
How much did the Lego Movie cost?,लेगो मूवी की लागत कितनी थी?
Where does Piccadilly start?,पिकाडिली कहां शुरू होती है?
Do Prince Harry and Prince William have the same parents?,क्या प्रिंस हैरी और प्रिंस विलियम के माता-पिता एक हैं?
Who played Agent Smith in Matrix?,मैट्रिक्स में किसने एजेंट स्मिथ को निभाया है ?
How many languages are spoken in Turkmenistan?,तुर्कमेनिस्तान में कितनी भाषाएं बोली जाती हैं?
In which films did Julia Roberts as well as Richard Gere play?,जूलिया रॉबर्ट्स और रिचर्ड गेरे ने किस फिल्म में अभिनय किया था?
In which country does the Ganges start?,गंगा किस देश में शुरू होती है?
In which year was Rachel Stevens born?,रेचल स्टीवंस का जन्म किस साल हुआ था?
Is Barack Obama a democrat?,क्या बराक ओबामा एक डेमोक्रेट है?
Where was Bach born?,बाख का जन्म कहाँ हुवा था?
How often did Jane Fonda marry?,जेन फोंडा ने कितनी बार शादी की?
Who was the first to climb Mount Everest?,माउंट एवरेस्ट पर चढ़ने वाला पहला कौन था?
How many people live in Poland?,पोलैंड में कितने लोग रहते हैं?
What is the location of the Houses of Parliament?,संसद के सदनों का स्थान क्या है?
Is Christian Bale starring in Batman Begins?,क्या क्रिस्चियन बॉल बैटमैन बेगिंस में है?
In which country is the Limerick Lake?,लिमरिक झील किस देश में है?
What was the last movie with Alec Guinness?,एलेक गिनीज की आखिरी फिल्म क्या थी?
What is the highest mountain in Australia?,ऑस्ट्रेलिया में सर्वोच्च पर्वत कोनसा है?
Is Frank Herbert still alive?,क्या फ्रैंक हरबर्ट अभी भी जीवित है?
Who created Family Guy?,फॅमिली गाए कौन ने बनाया है?
What is the official language of Suriname?,सूरीनाम की आधिकारिक भाषा क्या है?
Who wrote the song Hotel California?,गीत होटल कैलिफोर्निया कोंन ने लिखा था?
Give me all actors starring in movies directed by William Shatner.,विलियम शेटनेर द्वारा निर्देशित फिल्मों में सभी कलाकारों की सूचि दे।
What is in a chocolate chip cookie?,चॉकलेट चिप कुकी में क्या है?
Give me all professional skateboarders from Sweden.,मुझे स्वीडन से सभी पेशेवर स्केटबोर्डर की सूचि दो।
Which ingredients do I need for carrot cake?,गाजर केक के लिए मुझे कौन से सामग्री की आवश्यकता है?
Does Neymar play for Real Madrid?,क्या नेयमार रियल मैड्रिड के लिए खेलते हैं?
Which computer scientist won an oscar?,किस कंप्यूटर वैज्ञानिक ने ऑस्कर जीता?
How many companies were founded in the same year as Google?,कितनी कंपनियां स्थापित की गईं जिस वर्ष में गूगल हुइ?
In which UK city are the headquarters of the MI6?,किस यूके शहर में एमआई-6 का मुख्यालय है?
Was the Cuban Missile Crisis earlier than the Bay of Pigs Invasion?,क्या क्यूबाई मिसाइल संकट बे ऑफ़ पिग्स आक्रमण के पहले हुआ था?
What does IYCM stand for?,आईसीवायएम् का पूर्ण प्रपत्र क्या है?
When did the Ming dynasty dissolve?,मिंग राजवंश को कब भंग किया?
List all episodes of the first season of the HBO television series The Sopranos!,एचबीओ टेलीविजन श्रृंखला द सोप्रानोस! के पहले सीज़न के सभी एपिसोड की सूची बनाएं ।
"What is the total population of Melbourne, Florida?","मेलबोर्न, फ्लोरिडा की कुल आबादी क्या है?"
Did Arnold Schwarzenegger attend a university?,क्या अर्नोल्ड श्वार्ज़नेगर विश्वविद्यालय गए थे?
What country is Mount Everest in?,कोनसे देश में माउंट एवरेस्ट है?
What is the largest city in Australia?,ऑस्ट्रेलिया में सबसे बड़ा शहर क्या है?
Give me all launch pads operated by NASA.,मुझे नासा द्वारा संचालित सभी लॉन्च पैड की सूचि दें।
Who is the mayor of Tel Aviv?,तेल अवीव के महापौर कौन हैं?
List all episodes of the first season of the HBO television series The Sopranos.,एचओओ टेलीविजन श्रृंखला द सोप्रानोस के पहले सीज़न के सभी एपिसोड की सूची बनाएं। '
Who created Batman?,किसने बैटमैन बनाया?
Who played Gus Fring in Breaking Bad?,किसने गस फ्रिंग को ब्रेकिंग बैड में निभाया है ?
In which programming language is GIMP written?,जीआईएमपी किस प्रोग्रामिंग भाषा में लिखी गई है?
In which ancient empire could you pay with cocoa beans?,किस प्राचीन साम्राज्य में आप कोको बीन से भुगतान कर सकते हैं?
Who is the editor of Forbes?,फोर्ब्स के संपादक कौन है?
How many people live in the capital of Australia?,कितने लोग ऑस्ट्रेलिया की राजधानी में रहते हैं?
Which professional surfers were born in Australia?,कौन से पेशेवर सर्फरस ऑस्ट्रेलिया में पैदा हुए थे?
Which electronics companies were founded in Beijing?,बीजिंग में कौन से इलेक्ट्रॉनिक्स कंपनियां स्थापित की गई थीं?
Give me all video games published by Mean Hamster Software.,मीन हम्सटर सॉफ्टवेयर द्वारा प्रकाशित सभी वीडियो गेम की सूचि दें। '
How many Aldi stores are there?,आलड़ी के कितने स्टोर हैं?
What is the capital of Cameroon?,कैमरून की राजधानी क्या है?
Is there a video game called Battle Chess?,क्या बैटल चैस नामक वीडियो गेम है?
Was the wife of president Lincoln called Mary?,क्या राष्ट्रपति लिंकन की पत्नी का नाम मैरी था?
Give me all movies directed by Francis Ford Coppola.,मुझे फ्रांसिस फोर्ड कोपोला द्वारा निर्देशित सभी फिल्मों की सूचि दे ।
Which of Tim Burton's films had the highest budget?,टिम बर्टन की फिल्मों में से कौन सी का सबसे ज्यादा बजट था?
Does Breaking Bad have more episodes than Game of Thrones?,ब्रेकिंग बैड में गेम ऑफ़ थ्रोन्स की तुलना में अधिक एपिसोड हैं?
Who was called Rodzilla?,किसको रॉडज़िला कहा जाता था?
Was Natalie Portman born in the United States?,क्या नेटली पोर्टमैन संयुक्त राज्य में पैदा हुइ थी ?
Give me the grandchildren of Elvis Presley.,मुझे एल्विस प्रेस्ली के पोतों के नाम दे। 
Which movies starring Mickey Rourke were directed by Guy Ritchie?,मिकी रोर्के अभिनीत कौन सी फिल्में गाए रिची द्वारा निर्देशित थीं?
When did Dracula's creator die?,ड्रेकुला के निर्माता का निधन कब हुआ?
Which country does the creator of Miffy come from?,मिफ्फी के निर्माता किस देश से आते है?
What is Batman's real name?,बैटमैन का असली नाम क्या है?
What form of government does Russia have?,रूस की सरकार किस प्रकार की है?
How many companies were founded by the founder of Facebook?,फेसबुक के संस्थापक द्वारा कितनी कंपनियों की स्थापना की गई थी?
Give me all Canadian Grunge record labels.,मुझे सभी कैनेडियन ग्रांज रिकॉर्ड लेबल की सूचि दें।
How many children did Benjamin Franklin have?,बेंजामिन फ्रैंकलिन के कितने बच्चे हैं?
List the children of Margaret Thatcher.,मार्गरेट थैचर के बच्चों की सूची बनाएं।
From which region is the Melon de Bourgogne?,मेलन डी बर्गोगोन किस क्षेत्र से है?
Who is the oldest child of Meryl Streep?,मेरिल स्ट्रीप का सबसे पहला बच्चा कौन है?
Are tree frogs a type of amphibian?,क्या वृक्ष के मेंढक एक प्रकार की उभयचर हैं?
Is Christian Bale starring in Velvet Goldmine?,क्या वेलवेट गोल्डमाइन में अभिनीता क्रिस्चियन बेल है?
List all games by GMT.,जीएमटी द्वारा सभी खेलों की सूची बनाएं।
Does the Isar flow into a lake?,क्या ईसार एक झील में प्रवाहित होती है?
Which airports does Yeti Airlines serve?,यति एयरलाइंस किस हवाई अड्डे की सेवा करती है?
Which Indian company has the most employees?,किस भारतीय कंपनी में सबसे अधिक कर्मचारी हैं?
What color expresses loyalty?,कोनसा रंग वफादारी व्यक्त करता है?
Which city has the most inhabitants?,कौन से शहर में सबसे अधिक निवासी है?
Who created Wikipedia?,विकिपीडिया किसने बनाया?
Is Rita Wilson the wife of Tom Hanks?,क्या रीटा विल्सन टॉम हैंक्स की पत्नी है?
Is the wife of president Obama called Michelle?,क्या राष्ट्रपति ओबामा की पत्नी का नाम मिशेल है?
How many ethnic groups live in Slovenia?,कितने जातीय समूह स्लोवेनिया में रहते हैं?
Who is the president of Eritrea?,इरीट्रिया के राष्ट्रपति कौन है?
Which films did Stanley Kubrick direct?,स्टैनले कुब्री ने कौन सी फिल्मे निर्देशित की हैं ?
When was the Titanic completed?,टाइटैनिक कब पूरा हुआ?
How many pages does War and Peace have?,वॉर एंड पीस में कितने पृष्ठ हैं?
Who is the youngest player in the Premier League?,प्रीमियर लीग में सबसे कम उम्र के खिलाड़ी कौन हैं?
What is the highest mountain in Italy?,इटली में सर्वोच्च पर्वत कोनसा है?
How tall is Claudia Schiffer?,क्लाउडिया शिफ़ेर कितनी लंबी है?
Who was John F. Kennedy's vice president?,जॉन एफ कैनेडी के उपाध्यक्ष कौन थे?
Which subsidiary of Lufthansa serves both Dortmund and Berlin Tegel?,लुफ्तहांसा की कौन सी सहायक कंपनी डॉर्टमुंड और बर्लिन टेगल दोनों की सेवा करती है?
Who was the successor of John F. Kennedy?,जॉन एफ कैनेडी के उत्तराधिकारी कौन थे?
Who composed the soundtrack for Cameron's Titanic?,कैमरन टाइटैनिक के लिए साउंडट्रैक किसने बनाया है?
Which movies did Kurosawa direct?,कुरोसावा ने कौन सी फिल्मों का निर्देशन किया है ?
For which label did Elvis record his first album?,किस लेबल के लिए एल्विस ने अपना पहला एल्बम रिकॉर्ड किया था?
In which time zone is Rome?,रोम किस समय क्षेत्र में है?
Give me the currency of China.,मुझे चीन की मुद्रा बतायें ।
Who are the developers of DBpedia?,डीबीपीडिया के डेवलपर कौन हैं?
Does Abraham Lincoln's death place have a website?,अब्राहम लिंकन की मौत की जगह की बसाइट है?
Who is the king of the Netherlands?,नीदरलैंड का राजा कौन है?
In which city did Nikos Kazantzakis die?,निकोस काजांटाजाकिस का किस शहर में निधन हुआ ?
Who was the father of Queen Elizabeth II?,महारानी एलिजाबेथ द्वितीय के पिता कौन थे?
Give me a list of all critically endangered birds.,मुझे समीक्षकों से लुप्तप्राय पक्षियों की सूची बतायें ।
How many inhabitants does the largest city in Canada have?,कनाडा के सबसे बड़े शहर में कितने निवासी हैं?
In which military conflicts did Lawrence of Arabia participate?,अरब के लॉरेंस ने किस सैन्य युद्ध में भाग लिया?
Which book has the most pages?,कौन से पुस्तक में सबसे अधिक पृष्ठ हैं?
In which country does the Nile start?,नाइल नदी किस देश में शुरू होती है?
Who is the Formula 1 race driver with the most races?,सबसे अधिक दौड़ वाले फॉर्मूला 1 रेस ड्रायवर कौन है?
Which companies produce hovercrafts?,कौन सी कंपनियां हॉवरक्राफ्ट बनाती हैं?
Did Elvis Presley have children?,क्या एल्विस प्रेस्ली के बच्चे थे ?
In which city was the president of Montenegro born?,मोंटेनेग्रो के राष्ट्रपति किस शहर में पैदा हुए थे?
Which country was Bill Gates born in?,बिल गेट्स का जन्म किस देश में हुआ था?
In which countries do people speak Japanese?,किन देशों में लोग जापानी बोलते हैं?
Show me the book that Muhammad Ali wrote.,मुझे किताब बताओ जो मुहम्मद अली ने लिखी थी।
Is Michelle Obama the wife of Barack Obama?,क्या बराक ओबामा की पत्नी मिशेल ओबामा हैं?
What is the area code of Berlin?,बर्लिन का क्षेत्र कोड क्या है?
Give me all actors starring in Last Action Hero.,मुझे लास्ट एक्शन हीरो में अभिनीत सभी कलाकारों के नाम बतायें दो।
What are the nicknames of San Francisco?,सैन फ्रांसिस्को के उपनाम क्या हैं?
What was the first Queen album?,सबसे पहला क्वीन एल्बम क्या था?
Through which countries does the Yenisei river flow?,किस देश के माध्यम से यनेसी नदी का प्रवाह होता है?
Which television shows were created by Walt Disney?,वॉल्ट डिज़नी द्वारा किस टेलीविज़न शो का निर्माण किया गया था?
What is the bridge with the longest span?,सबसे लंबा पुल कौन सा है?
What country is Sitecore from?,साइटकोर कौन से देश से है?
Whom did Lance Bass marry?,लांस बास ने किससे शादी की?
What is the capital of Canada?,कनाडा की राजधानी क्या है?
Who was Vincent van Gogh inspired by?,विंसेंट वैन गाग किनसे प्रेरित थे ?
In which city did John F. Kennedy die?,किस शहर में जॉन एफ कैनेडी का निधन हुआ ?
Was U.S. president Jackson involved in a war?,क्या अमेरिका के राष्ट्रपति जैक्सन किसी युद्ध में शामिल थे?
Who wrote the Game of Thrones theme?,गेम ऑफ़ थ्रोन्स थीम किसने लिखी हैं ?
Who designed the Brooklyn Bridge?,ब्रुकलिन ब्रिज को किसने बनाया है?
When did Boris Becker end his active career?,बोरिस बेकर ने अपना सक्रिय कैरियर कब समाप्त किया?
Which types of grapes grow in Oregon?,ओरेगन में किस प्रकार के अंगूर उगते हैं?
How tall is Michael Jordan?,माइकल जॉर्डन कितना लंबा है?
To which party does the mayor of Paris belong?,पेरिस के महापौर किस पार्टी के हैं?
Who wrote the book The Pillars of the Earth?,किसने द पिल्लर्स ऑफ द अर्थ किताब को लिखा हैं ?
Who was the 16th president of the United States?,संयुक्त राज्य के 16 वें राष्ट्रपति कौन थे?
How high is the Mount Everest?,माउंट एवरेस्ट कितना ऊँचा है?
Who was the doctoral supervisor of Albert Einstein?,अल्बर्ट आइंस्टीन के डॉक्टरेट के पर्यवेक्षक कौन थे?
In which city does Sylvester Stallone live?,सिल्वेस्टर स्टेलोन किस शहर में रहते हैं?
What is the currency of the Czech Republic?,चेक गणराज्य की मुद्रा क्या है?
Did Socrates influence Aristotle?,क्या एरिस्टोटल सोक्रेटस से प्रभावित थे?
What is the time zone of Salt Lake City?,साल्ट लेक सिटी का समय क्षेत्र क्या है?
Who is the son of Sonny and Cher?,सोनि और चेर का बेटा कौन है?
In which city are the headquarters of the United Nations?,संयुक्त राष्ट के मुख्यालय कौन सा शहर में हैं?
Who is the founder of Penguin Books?,पेंगुइन बुक्स के संस्थापक कौन हैं?
When was Jack Wolfskin founded?,जैक वुल्फस्किन की स्थापना कब हुई थी?
