input_lang,output_lang
Who is the mayor of Rotterdam?,रॉटरडैम के महपौर कौन हैं?
Give me all Swedish oceanographers.,मुझे सभी स्वीडिश महासागरीय वैज्ञानिकों की सूचि बतायें।
Show me Hemingway's autobiography.,हेमिंग्वे की आत्मकथा मुझे दिखायें।
Who are the parents of the wife of Juan Carlos I?,जुआन कार्लोस-१ की पत्नी के माता-पिता कौन हैं?
Did Tesla win a nobel prize in physics?,क्या टेस्ला ने भौतिक विज्ञान में नोबेल पुरस्कार जीता?
Who is the tallest basketball player?,सबसे लंबा बास्केटबॉल खिलाड़ी कौन है?
Which city has the least inhabitants?,सबसे कम निवासियों वाला शहर कौन सा है?
Is proinsulin a protein?,क्या प्रोइन्सुलिन एक प्रोटीन है?
Who were the parents of Queen Victoria?,महारानी विक्टोरिया के माता-पिता कौन थे?
Did Che Guevara have children?,क्या चे ग्वेरा के बच्चे हैं?
Is Lake Baikal bigger than the Great Bear Lake?,क्या जैक बेयर झील तुलना में बाइकाल झील बड़ी है?
Did Kaurismäki ever win the Grand Prix at Cannes?,क्या कौरिस्म्की कभी कैनन्स में ग्रांड प्रिक्स जीते हैं?
Give me all books by William Goldman with more than 300 pages.,मुझे ३०० से अधिक पृष्ठों के साथ विलियम गोल्डमैन की किताबें की सूचि बतायें।
Where is Fort Knox located?,फोर्ट नॉक्स कहां स्थित है?
In which U.S. state is Fort Knox located?,सैयुक्त राज्य के किस राज्य में फोर्ट नॉक्स स्थित है?
Where is Syngman Rhee buried?,सिन्गमैन र्ही कहाँ दफनाया गया है?
What is the timezone in San Pedro de Atacama?,सैन पेड्रो डे अटाकामा में समय क्षेत्र क्या है?
To which artistic movement did the painter of The Three Dancers belong?,द थ्री डांसर्स के चित्रकार किस कलात्मक आंदोलन से हैं?
Which scientist is known for the Manhattan Project and the Nobel Peace Prize?,कौन सा वैज्ञानिक मैनहट्टन प्रोजेक्ट और नोबेल शांति पुरस्कार के लिए जाना जाता है?
Show me all books in Asimov's Foundation series.,असिमोव की फाउंडेशन श्रृंखला की सारी पुस्तकों की सूचि दिखाएं।
Give me all cities in New Jersey with more than 100000 inhabitants.,मुझे न्यू जर्सी के १००००० से अधिक निवासियों के साथ सभी शहरों की सूचि बतायें।
Which museum in New York has the most visitors?,न्यूयॉर्क में कौन से संग्रहालय में सबसे अधिक आगंतुक हैं?
How high is the Yokohama Marine Tower?,योकोहामा समुद्री टॉवर कितना ऊँचा है?
Does the new Battlestar Galactica series have more episodes than the old one?,क्या नई बट्ट्लैस्टार गैलेक्टिका सीरीज़ के पुराने संस्करणों की तुलना में अधिक एपिसोड हैं?
Who is the youngest Darts player?,सबसे छोटा डार्ट्स खिलाड़ी कौन है?
Who developed the video game World of Warcraft?,वर्ल्ड ऑफ़ वारक्राफ़्ट गेम किसने विकसित किया हैं?
Who was the pope that founded the Vatican Television?,किस पोप ने वेटिकन टेलीविजन की स्थापना की थी?
Who composed the music for Harold and Maude?,हेरोल्ड एंड मॉड के लिए संगीत किसने बनाया था?
Give me all members of Prodigy.,मुझे प्रोडिजी के सभी सदस्यों की सूचि बतायें।
Who is starring in Spanish movies produced by Benicio del Toro?,बेनिसीओ डेल टोरो द्वारा निर्मित स्पेनिश फिल्मों में कौन अभिनय करता है?
Which subsidiary of TUI Travel serves both Glasgow and Dublin?,टीयूआई ट्रैवल की कौन सी सहायक कंपनी ग्लासगो और डबलिन को सेवाएं देती है?
In which country is Mecca located?,मक्का किस देश में स्थित है?
How many languages are spoken in Colombia?,कोलंबिया में कितनी भाषाएं बोली जाती हैं?
What is the biggest stadium in Spain?,"स्पेन, सबसे बड़ा, स्टेडियम"
Which professional surfers were born on the Philippines?,फिलीपींस पर कौन से पेशेवर सर्फर्स पैदा हुए थे?
What are the five boroughs of New York?,न्यूयॉर्क के पांच नगर क्या हैं?
Is Cola a beverage?,क्या कोला एक पेय है?
When did princess Diana die?,राजकुमारी डायना का निधन कब हुआ?
Where in France is sparkling wine produced?,फ्रांस में स्पार्कलिंग वाइन का उत्पादन कहाँ होता है?
List all boardgames by GMT.,जीएमटी द्वारा सभी बोर्ड गेम सूचीबद्ध करें।
Who developed Skype?,स्काइप किसने विकसित किया?
Which people were born in Heraklion?,हेराक्लिओन में कौन से लोग पैदा हुए थे?
In which U.S. state is Area 51 located?,यू.एस. के किस राज्य में क्षेत्र 51 स्थित है?
Who is the mayor of New York City?,न्यूयॉर्क शहर के महापौर कौन हैं?
Which countries have places with more than two caves?, किन देशों में दो से अधिक गुफाएं हैं?
Where did Abraham Lincoln die?,अब्राहम लिंकन का देहांत कहा हुआ था? 
Which airports does Air China serve?,एयर चाइना किस हवाई अड्डे पर सेवा करता है?
Give me all actors starring in movies directed by and starring William Shatner.,विलियम शेटनर द्वारा निर्देशित और अभिनीत फिल्मों में अभिनय करने वाले सभी कलाकारों की सूची दें।
What are the official languages of the Philippines?,फिलीपींस की आधिकारिक भाषाएं क्या हैं?
Give me all Danish films.,मुझे सभी डेनिश फिल्में दें।
Which movies starring Brad Pitt were directed by Guy Ritchie?, ब्रैड पिट अभिनीत कौन सी फिल्में गाय रिची द्वारा निर्देशित की गई थीं?
Give me the grandchildren of Bruce Lee.,मुझे ब्रूस ली के पोते के नाम दो।
Which other weapons did the designer of the Uzi develop?, उजी के डिजाइनर ने कौन से अन्य हथियार विकसित किए?
Who is the owner of Universal Studios?,यूनिवर्सल स्टूडियो का मालिक कौन है?
Which state of the USA has the highest population density?,संयुक्त राज्य अमेरिका का सबसे ज्यादा जनसंख्या घनत्व राज्य कौनसा है?
Which monarchs were married to a German?, कौन कौन से सम्राटों ने जर्मन नागरिक से शादी थी?
Which organizations were founded in 1950?, 1950 में किस संगठनों  की स्थापना की गई थी?
Who created the comic Captain America?, हास्य कप्तान अमेरिका किसने बनाया?
Give me the Apollo 14 astronauts., मुझे अपोलो 14 के अंतरिक्ष यात्री के नाम दें।
Who wrote the book The pillars of the Earth?,पृथ्वी के स्तंभों पुस्तक को किसने लिखा था?
Which state of the United States of America has the highest density?,संयुक्त राज्य अमेरिका की किस राज्य में उच्चतम घनत्व है?
Which spaceflights were launched from Baikonur?,बाइकोनूर से कौन सी अंतरिक्ष उड़ान की गई थी?
Give me a list of all trumpet players that were bandleaders.,मुझे सभी तुरही खिलाड़ियों की एक सूची दें जो बैंडलीडर थे।
Which U.S. states are in the same timezone as Utah?,यूटा के रूप में एक ही समय क्षेत्र में कौन से अमेरिकी राज्य हैं?
Which U.S. states possess gold minerals?,किस अमेरिकी राज्य में सोने के खनिज हैं?
Who is the daughter of Ingrid Bergman married to?,इंग्रिड बर्गमैन की पुत्री कि शादी किसके साथ हुई?
How deep is Lake Placid?,झील प्लेसिड कितना गहरा है?
Show me all museums in London.,मुझे लंदन में सभी संग्रहालय दिखाओ। 
Who is the tallest player of the Atlanta Falcons?,अटलांटा फाल्कन का सबसे लंबा खिलाड़ी कौन है?
What are the top-10 action role-playing video games according to IGN?,आईजीएन के मुताबिक शीर्ष-10 एक्शन रोल-प्लेइंग वीडियो गेम क्या हैं?
Give me all writers that won the Nobel Prize in literature., मुझे उन सभी लेखकों के नाम दें जिन्होंने साहित्य में नोबेल पुरस्कार जीता।
Show me all basketball players that are higher than 2 meters.,मुझे सभी बास्केटबाल खिलाड़ियों को दिखाएं जो 2 मीटर से अधिक हैं।
When was the Statue of Liberty built?,स्टेच्यू ऑफ लिबर्टी कब बनाया गया था?
Which states border Illinois?,इलिनोइस के साथ किन राज्यों की सीमाएं हैं? 
Who developed Minecraft?,कौन विकसित Minecraft? 
Where did Hillel Slovak die?, हिलेल स्लोवाक की मौत कहां हुई?
What movies does Jesse Eisenberg play in?,जेसी ईसेनबर्ग  ने किस फिल्मों में काम किया है? 
Give all swimmers that were born in Moscow., मॉस्को में पैदा हुए सभी तैराकों के नाम दें।
Give me all cosmonauts.,देना मुझे सब अंतरिक्ष यात्री। 
Give me all Swiss non-profit organizations.,मुझे सभी स्विस गैर लाभ संगठनों के नाम दें।
Which presidents were born in 1945?, 1945 में कौन कौन से राष्ट्रपति पैदा हुए थे?
What kind of music did Lou Reed play?,लो रीड किस तरह का संगीत बजाता था?
Where do the Red Sox play?,रेड सॉक्स कहां खेलता है?
Show a list of soccer clubs that play in the Bundesliga., बुन्डेस्लिगा में खेलने वाले फुटबॉल क्लबों की एक सूची दिखाएं।
Which volcanos in Japan erupted since 2000?,कौन कौन से ज्वालामुखी में जापान भड़क उठी जबसे 2000? 
Which bridges cross the Seine?,कौन कौन से पुल सीन को पार करते हैं?
What is the official color of the University of Oxford?,ऑक्सफोर्ड विश्वविद्यालय का आधिकारिक रंग क्या है?
How many films did Hal Roach produce?,हैल रोच ने कितनी फिल्में उत्पादित की?
Give me all Danish movies.,देना मुझे सब डेनिश चलचित्र। 
What is the most frequent cause of death?,मृत्यु का सबसे अधिकांश बारंबार कारण क्या है?
Give me all companies in Munich., मुझे म्यूनिख में सभी कंपनियों के नाम दो।
Give me the capitals of all countries that the Himalayas run through.,मुझे उन सभी देशों की राजधानियां दें जिनमें हिमालय हैं।
How many movies did Park Chan-wook direct?,पार्क चैन-वुक द्वारा कितनी फिल्में निर्देशित की गई थीं?
Which rivers flow into a German lake?,कौन सी नदियां जर्मन झील में बहती हैं?
How many airlines are there?,कितने विमान सेवाओं मौजूद हैं? 
Give me all islands that belong to Japan.,मुझे जापान के सभी द्वीप के नाम दें।
How many inhabitants does Maribor have?,मेरिबोर मे कितने निवासी हैं?
Give me all Apollo 14 astronauts.,मुझे सभी अपोलो 14 अंतरिक्ष यात्री के नाम दें।
Which companies have more than 1 million employees?,कौन कौन से कंपनियों मे दस लाख सेअधिक कर्मचारि है? 
In which films directed by Garry Marshall was Julia Roberts starring?, गैरी मार्शल द्वारा निर्देशित कौन सी फिल्मों में जूलिया रॉबर्ट्स हैं?
Give me all soccer clubs in the Premier League.,मुझे प्रीमियर लीग के सभी सॉकर क्लब के नाम दें।
What is the highest place of the Urals?,यूराल की उच्चतम जगह क्या है?
Who is the governor of Wyoming?,वायोमिंग का गवर्नर कौन है?
Where did the architect of the Eiffel Tower study?,कहा पे किया  वास्तुकार का  एफिल मीनार अध्ययन? 
Give me all world heritage sites designated within the past two years.,मुझे पिछले दो वर्षों में नामित सभी विश्व धरोहर स्थलों  के नाम दें।
Give me all actors who were born in Paris after 1950.,मुझे उन सभी कलाकारों के नाम दें जो 1950 के बाद पेरिस में पैदा हुए थे। 
Which movies star both Liz Taylor and Richard Burton?,लिज़ टेलर और रिचर्ड बर्टन दोनों ने किस चलचित्र मे भूमिका निभाई?
Give me all Australian nonprofit organizations.,मुझे सभी ऑस्ट्रेलियाई गैर-लाभकारी संगठन के नाम दें।
Which pope succeeded John Paul II?,कौन कौन से पोप सफल हुए जॉन पॉल द्वितीय? 
Give me all ESA astronauts.,देना मुझे सब ईएसए अंतरिक्ष यात्री। 
Who was president of Pakistan in 1978?,1978 में पाकिस्तान के राष्ट्रपति कौन थे?
Who is the owner of Rolls-Royce?,रोल्स-रॉयस का मालिक कौन है?
How many museums does Paris have?,पेरिस में कितने संग्रहालय हैं?
Where was JFK assassinated?,जेएफके की हत्या कहाँ हुई थी?
Give me all federal chancellors of Germany., मुझे जर्मनी के सभी संघीय चांसलर दें।
Show me everyone who was born on Halloween.,हेलोवीन पर पैदा हुए सभी को दिखाएं।
To which countries does the Himalayan mountain system extend?, हिमालय पर्वत प्रणाली किन देशो में विस्तारित करती है?
Which actors were born in Germany?,जर्मनी में कौन से अभिनेता पैदा हुए थे?
How much carbs does peanut butter have?, मूंगफली के मक्खन में कितने कार्बोहाइड्रेट हैं?
Who produced the most films?,सबसे अधिक फिल्में किसने बनाई?
How many employees does Google have?, गूगल के कितने कर्मचारी हैं?
Give me all actors who were born in Berlin.,मुझे बर्लिन में पैदा हुए सभी कलाकारों को दो।
Who created Goofy?,गूफी किसने बनाया?
Which music albums contain the song Last Christmas?,कौन से संगीत एल्बम में अंतिम क्रिसमस गीत है?
When was Alberta admitted as province?,अल्बर्टा को प्रांत के रूप में कब स्वीकार किया गया था?
How many missions does the Soyuz programme have?,सोयुज़ कार्यक्रम में कितने मिशन हैं?
Give me all the TV shows with Neil Patrick Harris., मुझे नील पैट्रिक हैरिस वाले सभी टीवी शो दें।
When were the Hells Angels founded?,हेल ​​एंजल्स की स्थापना कब हुई थी?
What is the net income of Apple?,ऐप्पल की कुल आय क्या है?
Give me all Swedish holidays.,मुझे सभी स्वीडिश छुट्टियों की सूची दें
In which city was the former Dutch queen Juliana buried?,पूर्व डच रानी जूलियाना को किस शहर में दफनाया गया था?
List all the musicals with music by Leonard Bernstein.,लियोनार्ड बर्नस्टीन द्वारा संगीत के साथ सभी संगीत सूचीबद्ध करें।
Give me all companies in the advertising industry.,मुझे विज्ञापन उद्योग के सभी कंपनियों के नाम दें।
What is the largest metropolitan area in Washington state?, वाशिंगटन राज्य में सबसे बड़ा महानगरीय क्षेत्र क्या है?
Who killed John Lennon?,जॉन लेनन  को किसने मारा?
Which writers studied in Istanbul?, इस्तांबुल में कौन कौन से लेखकों  ने अध्ययन किया?
Give me all Australian metalcore bands.,मुझे सभी ऑस्ट्रेलियाई मेटलकोर बैंड दें।
Which countries adopted the Euro?, किन किन देशों ने यूरो अपनाया?
Give me all types of eating disorders.,मुझे सभी प्रकार के खाने के विकार दें।
Was Marc Chagall a jew?,मार्क चगल एक यहूदी था?
What was Brazil's lowest rank in the FIFA World Ranking?,फीफा विश्व रैंकिंग में ब्राजील का सबसे कम रैंक क्या था?
How many films did Leonardo DiCaprio star in?,लियोनार्डो दी कैप्रियो की कितनी फिल्में हैं?
Was Margaret Thatcher a chemist?,मार्गरेट थैचर एक रसायनज्ञ था?
Which U.S. states are in the same time zone as Utah?, यूटा के रूप में एक ही समय क्षेत्र में कौन से अमेरिकी राज्य हैं?
Give me all books written by Danielle Steel., मुझे डेनियल स्टील द्वारा लिखी गई सभी किताबें दें।
Which country has the most official languages?, किस देश में सबसे अधिक आधिकारिक भाषाएं हैं?
What is the total amount of men and women serving in the FDNY?,एफडीएनवाई में सेवा करने वाले पुरुषों और महिलाओं की कुल राशि क्या है?
Which actor played Chewbacca?, चेवबाका के रूप में किस अभिनेता ने अभिनय किया?
Give me all libraries established earlier than 1400., मुझे 1400 से पहले स्थापित सभी पुस्तकालयों दें।
Which programming languages were influenced by Perl?,पर्ल द्वारा कौन सी प्रोग्रामिंग भाषा प्रभावित थी?
In which U.S. state is Mount McKinley located?,माउंट मैककिनले किस अमेरिकी राज्य में स्थित है?
What airlines are part of the SkyTeam alliance?,स्काईटाम गठबंधन का कौन सा एयरलाइन हिस्सा है?
Which ships were called after Benjamin Franklin?,कौन कौन से जहाजों थे बुलाया बाद बेंजामिन फ्रेंकलिन? 
Give me all Methodist politicians.,देना मुझे सब एक क्रिस्तानी पंथ नेताओं। 
What other books have been written by the author of The Fault in Our Stars?,क्या अन्य पुस्तकें है गया लिखा हुआ द्वारा  लेखक का  दोष में हमारी सितारे? 
What is the highest mountain?,क्या है  उच्चतम पर्वत? 
Which poet wrote the most books?,कौन कौन से कवि लिखा था  अधिकांश पुस्तकें? 
Which programming languages influenced Javascript?,कौन कौन से प्रोग्रामिंग भाषाओं प्रभावित जावास्क्रिप्ट? 
Which musician wrote the most books?,कौन कौन से संगीतकार लिखा था  अधिकांश पुस्तकें? 
Which films starring Clint Eastwood did he direct himself?,कौन कौन से फिल्मों अभिनीत क्लिंट ईस्टवुड किया वह प्रत्यक्ष खुद को? 
Which software has been developed by organizations founded in California?,कौन कौन से सॉफ्टवेयर है गया विकसित द्वारा संगठनों स्थापित में कैलिफोर्निया? 
